Symbol,Security Name
PPTY,U.S. Diversified Real Estate ETF
PPYA,Papaya Growth Opportunity Corp. I - Class A Common Stock
PPYAU,Papaya Growth Opportunity Corp. I - Unit
PPYAW,Papaya Growth Opportunity Corp. I - Warrant
PQDI,Principal Spectrum Tax-Advantaged Dividend Active ETF
PR,Permian Resources Corporation Class A Common Stock
PRA,ProAssurance Corporation Common Stock
PRAA,"PRA Group, Inc. - Common Stock"
PRAE,Northern Lights Fund Trust III PlanRock Alternative Growth ETF
PRAX,"Praxis Precision Medicines, Inc. - Common Stock"
PRAY,NEOS ETF Trust FIS Christian Stock Fund
PRCH,"Porch Group, Inc. - Common Stock"
PRCT,PROCEPT BioRobotics Corporation - Common Stock
PRDO,Perdoceo Education Corporation - Common Stock
PRE,Prenetics Global Limited - Class A Ordinary Share
PREF,Principal Spectrum Preferred Securities Active ETF
PRENW,Prenetics Global Limited - Warrant
PRF,Invesco FTSE RAFI US 1000 ETF
PRFD,PIMCO U.S. Treasury Index Fund PIMCO Preferred and Capital Securities Active Exchange-Traded Fund
PRFX,PainReform Ltd. - Ordinary Shares
PRFZ,Invesco FTSE RAFI US 1500 Small-Mid ETF
PRG,"PROG Holdings, Inc. Common Stock"
PRGO,Perrigo Company plc Ordinary Shares
PRGS,Progress Software Corporation - Common Stock
PRH,"Prudential Financial, Inc. 5.950% Junior Subordinated Notes due 2062"
PRI,"Primerica, Inc. Common Stock"
PRIF$D,"Priority Income Fund, Inc. 7.00% Series D Term Preferred Stock due 2029"
PRIF$F,"Priority Income Fund, Inc. 6.625% Series F Term Preferred Stock due 2027"
PRIF$G,"Priority Income Fund, Inc. 6.25% Series G Preferred Stock Due 2026"
PRIF$H,"Priority Income Fund, Inc. 6.00% Series H Term Preferred Stock due 2026"
PRIF$I,"Priority Income Fund, Inc. 6.125% Series I Term Preferred Stock due 2028"
PRIF$J,"Priority Income Fund, Inc. 6.000% Series J Term Preferred Stock due 2028"
PRIF$K,"Priority Income Fund, Inc. 7.000% Series K Cumulative Preferred Stock"
PRIF$L,"Priority Income Fund, Inc. 6.375% Series L Term Preferred Stock Due 2029"
PRIM,Primoris Services Corporation Common Stock
PRK,Park National Corporation Common Stock
PRKS,United Parks & Resorts Inc. Common Stock
PRLB,"Proto Labs, Inc. Common stock"
PRLD,Prelude Therapeutics Incorporated - Common Stock
PRLH,Pearl Holdings Acquisition Corp - Class A Ordinary Shares
PRLHU,Pearl Holdings Acquisition Corp - Unit
PRLHW,Pearl Holdings Acquisition Corp - Warrant
PRM,"Perimeter Solutions, SA Ordinary Shares"
PRMB,Primo Brands Corporation Class A Common Stock
PRME,"Prime Medicine, Inc. - Common Stock"
PRMN,Northern Lights Fund Trust III PlanRock Market Neutral Income ETF
PRN,Invesco Dorsey Wright Industrials Momentum ETF
PRNT,3D Printing (The) ETF
PRO,"PROS Holdings, Inc. Common Stock"
PROC,"Procaps Group, S.A. - Ordinary Shares"
PROCW,"Procaps Group, S.A. - Warrants"
PROF,Profound Medical Corp. - common stock
PROK,ProKidney Corp. - Class A Ordinary Shares
PROP,Prairie Operating Co. - Common Stock
PROV,"Provident Financial Holdings, Inc. - Common Stock"
PRPH,"ProPhase Labs, Inc. - Common Stock"
PRPL,"Purple Innovation, Inc. - Common Stock"
PRPO,"Precipio, Inc. - Common Stock"
PRQR,ProQR Therapeutics N.V. - Ordinary Shares
PRS,"Prudential Financial, Inc. 5.625% Junior Subordinated Notes due 2058"
PRSO,Peraso Inc. - Common Stock
PRT,PermRock Royalty Trust Trust Units
PRTA,Prothena Corporation plc - Ordinary Shares
PRTC,PureTech Health plc - American Depositary Shares
PRTG,Portage Biotech Inc. - Common Stock
PRTH,"Priority Technology Holdings, Inc. - Common Stock"
PRTS,"CarParts.com, Inc. - Common Stock"
PRU,"Prudential Financial, Inc. Common Stock"
PRVA,"Privia Health Group, Inc. - Common Stock"
PRZO,ParaZero Technologies Ltd. - Ordinary Shares
PSA,Public Storage Common Stock
PSA$F,"Public Storage Depositary Shares Each Representing 1/1,000 of a 5.15% Cumulative Preferred Share of Beneficial Interest, Series F, par value $0.01 per share"
PSA$G,"Public Storage Depositary Shares, Each Representing 1/1,000 of a 5.05% Cumulative Preferred Share of Beneficial Interest, Series G"
PSA$H,"Public Storage Depositary Shares Each Representing 1/1,000 of a  5.60% Cumulative Preferred  Share of Beneficial Interest, Series H"
PSA$I,"Public Storage Depositary Shares Each Representing 1/1,000 of a 4.875% Cumulative Preferred Share of Beneficial Interest, Series I, par value $0.01 per share"
PSA$J,"Public Storage Depositary Shares Each Representing 1/1,000 of a 4.700% Cumulative Preferred Share of Beneficial Interest, Series J, par value $0.01 per share"
PSA$K,"Public Storage Depositary Shares Each Representing 1/1,000 of a 4.75% Cumulative Preferred Share of Beneficial Interest, Series K"
PSA$L,"Public Storage Depositary Shares Each Representing 1/1,000 of a 4.625% Cumulative Preferred Share of Beneficial Interest, Series L, par value $0.01 per share"
PSA$M,"Public Storage Depositary Shares Each Representing 1/1,000 of a 4.125% Cumulative Preferred Share of Beneficial Interest, Series M"
PSA$N,"Public Storage Depositary Shares Each Representing 1/1,000 of a 3.875% Cumulative Preferred Share of Beneficial Interest, Series N"
PSA$O,"Public Storage Depositary Shares Each Representing 1/1,000 of a 3.900% Cumulative Preferred Share of Beneficial Interest, Series O"
PSA$P,"Public Storage Depositary Shares Each Representing 1/1,000 of a 4.000% Cumulative Preferred Share of Bene cial Interest, Series P"
PSA$Q,"Public Storage Depositary Shares Each Representing 1/1,000 of a 3.950% Cumulative Preferred Share of Beneficial Interest, Series Q, par value $0.01 per share"
PSA$R,"Public Storage Depositary Shares Each Representing 1/1,000 of a 4.00% Cumulative Preferred Share of Bene cial Interest, Series R"
PSA$S,"Public Storage Depositary Shares Each Representing 1/1,000 of a 4.100% Cumulative Preferred Share of Beneficial Interest, Series S"
PSBD,Palmer Square Capital BDC Inc. Common Stock
PSC,Principal U.S. Small-Cap ETF
PSCC,Invesco S&P SmallCap Consumer Staples ETF
PSCD,Invesco S&P SmallCap Consumer Discretionary ETF
PSCE,Invesco S&P SmallCap Energy ETF
PSCF,Invesco S&P SmallCap Financials ETF
PSCH,Invesco S&P SmallCap Health Care ETF
PSCI,Invesco S&P SmallCap Industrials ETF
PSCJ,Pacer Swan SOS Conservative (July) ETF
PSCM,Invesco S&P SmallCap Materials ETF
PSCQ,Pacer Swan SOS Conservative (October) ETF
PSCT,Invesco S&P SmallCap Information Technology ETF
PSCU,Invesco S&P SmallCap Utilities & Communication Services ETF
PSCW,Pacer Swan SOS Conservative (April) ETF
PSCX,Pacer Swan SOS Conservative (January) ETF
PSDM,PGIM ETF Trust PGIM Short Duration Multi-Sector Bond ETF
PSEC,Prospect Capital Corporation - Closed End Fund
PSEC$A,Prospect Capital Corporation 5.35% Series A Fixed Rate Cumulative Perpetual Preferred Stock
PSEP,Innovator U.S. Equity Power Buffer ETF - September
PSET,Principal Quality ETF
PSF,"Cohen & Steers Select Preferred and Income Fund, Inc. Common Stock"
PSFD,Pacer Swan SOS Flex (January) ETF
PSFE,Paysafe Limited Common Shares
PSFE.W,"Paysafe Limited Warrants, exercisable for one Common Share of Paysafe Limited at a price of $11.50 per share"
PSFF,Pacer Swan SOS Fund of Funds ETF
PSFJ,Pacer Swan SOS Flex (July) ETF
PSFM,Pacer Swan SOS Flex (April) ETF
PSFO,Pacer Swan SOS Flex (October) ETF
PSH,PGIM ETF Trust PGIM Short Duration High Yield ETF
PSHG,Performance Shipping Inc. - Common Shares
PSI,Invesco Semiconductors ETF
PSIG,PS International Group Ltd. - Ordinary Shares
PSIL,AdvisorShares Psychedelics ETF
PSK,SPDR ICE Preferred Securities ETF
PSL,Invesco Dorsey Wright Consumer Staples Momentum ETF
PSLV,Sprott Physical Silver Trust ETV
PSMD,Pacer Swan SOS Moderate (January) ETF
PSMJ,Pacer Swan SOS Moderate (July) ETF
PSMO,Pacer Swan SOS Moderate (October) ETF
PSMR,Pacer Swan SOS Moderate (April) ETF
PSMT,"PriceSmart, Inc. - Common Stock"
PSN,Parsons Corporation Common Stock
PSNL,"Personalis, Inc. - Common Stock"
PSNY,Polestar Automotive Holding UK Limited - Class A ADS
PSNYW,Polestar Automotive Holding UK Limited - Class C-1 ADS (ADW)
PSO,"Pearson, Plc Common Stock"
PSP,Invesco Global Listed Private Equity ETF
PSQ,ProShares Short QQQ
PSQA,Palmer Square Funds Trust Palmer Square CLO Senior Debt ETF
PSQH,"PSQ Holdings, Inc. Class A Common Stock"
PSQH.W,"PSQ Holdings, Inc. Warrants, each exercisable for one share of Class A common stock at an exercise price of $11.50 per share"
PSQO,Palmer Square Funds Trust Palmer Square Credit Opportunities ETF
PSR,Invesco Active U.S. Real Estate Fund
PST,ProShares UltraShort Lehman 7-10 Year Treasury
PSTG,"Pure Storage, Inc. Class A Common Stock"
PSTL,"Postal Realty Trust, Inc. Class A Common Stock"
PSTP,Innovator ETFs Trust Innovator Power Buffer Step-Up Strategy ETF
PSTR,PeakShares Sector Rotation ETF
PSTV,"PLUS THERAPEUTICS, Inc. - Common Stock"
PSTX,"Poseida Therapeutics, Inc. - Common Stock"
PSWD,Xtrackers Cybersecurity Select Equity ETF
PSX,Phillips 66 Common Stock
PT,Pintec Technology Holdings Limited - American Depositary Shares
PTA,Cohen & Steers Tax-Advantaged Preferred Securities and Income Fund Common Shares of Beneficial Interest
PTBD,Pacer Trendpilot US Bond ETF
PTC,PTC Inc. - Common Stock
PTCT,"PTC Therapeutics, Inc. - Common Stock"
PTEC,Global X PropTech ETF
PTEN,"Patterson-UTI Energy, Inc. - Common Stock"
PTEU,Pacer TrendpilotTM European Index ETF
PTF,Invesco Dorsey Wright Technology Momentum ETF
PTGX,"Protagonist Therapeutics, Inc. - Common Stock"
PTH,Invesco Dorsey Wright Healthcare Momentum ETF
PTHL,Pheton Holdings Ltd - Class A Ordinary Shares
PTIN,Pacer Trendpilot International ETF
PTIR,GraniteShares 2x Long PLTR Daily ETF
PTIX,"Protagenic Therapeutics, Inc. - Common Stock"
PTIXW,"Protagenic Therapeutics, Inc. - Warrant"
PTL,Northern Lights Fund Trust IV Inspire 500 ETF
PTLC,Pacer Fund Trust Pacer Trendpilot US Large Cap ETF
PTLE,PTL LTD - Ordinary Shares
PTLO,Portillo's Inc. - Class A Common Stock
PTMC,Pacer Trendpilot US Mid Cap ETF
PTMN,Portman Ridge Finance Corporation - Closed End Fund
PTN,"Palatin Technologies, Inc. Common Stock"
PTNQ,Pacer Trendpilot 100 ETF
PTON,"Peloton Interactive, Inc. - Common Stock"
PTPI,"Petros Pharmaceuticals, Inc. - Common Stock"
PTRB,PGIM ETF Trust PGIM Total Return Bond ETF
PTVE,Pactiv Evergreen Inc. - Common stock
PTY,Pimco Corporate & Income Opportunity Fund
PUBM,"PubMatic, Inc. - Class A Common Stock"
PUI,Invesco Dorsey Wright Utilities Momentum ETF
PUK,Prudential Public Limited Company Common Stock
PULM,"Pulmatrix, Inc. - Common Stock"
PULS,PGIM Ultra Short Bond ETF
PULT,Putnam ETF Trust Putnam ESG Ultra Short ETF
PUMP,ProPetro Holding Corp. Common Stock
PUSH,PGIM ETF Trust PGIM Ultra Short Municipal Bond ETF
PUTD,Cboe Validus S&P 500 Dynamic PutWrite Index ETF
PUTW,WisdomTree PutWrite Strategy Fund
PVAL,Putnam Focused Large Cap Value ETF
PVBC,"Provident Bancorp, Inc. - Common Stock"
PVH,PVH Corp. Common Stock
PVI,Invesco Floating Rate Municipal Income ETF
PVL,Permianville Royalty Trust Trust Units 
PW,Power REIT (MD) Common Stock
PW$A,Power REIT 7.75% Series A Cumulative Perpetual Preferred Stock
PWB,Invesco Large Cap Growth ETF
PWER,Macquarie ETF Trust Macquarie Energy Transition ETF
PWM,Prestige Wealth Inc. - Class A Ordinary Shares
PWOD,"Penns Woods Bancorp, Inc. - Common Stock"
PWP,Perella Weinberg Partners - Class A Common Stock
PWR,"Quanta Services, Inc. Common Stock"
PWS,Pacer WealthShield ETF 
PWUP,PowerUp Acquisition Corp. - Class A Ordinary Shares
PWUPU,PowerUp Acquisition Corp. - Unit
PWUPW,PowerUp Acquisition Corp. - Warrant
PWV,Invesco Large Cap Value ETF
PWZ,Invesco California AMT-Free Municipal Bond Portfolio
PX,"P10, Inc. Class A Common Stock"
PXDT,"Pixie Dust Technologies, Inc. - ADS, each representing one common share"
PXE,Invesco Energy Exploration & Production ETF
PXF,Invesco FTSE RAFI Developed Markets ex-U.S. ETF
PXH,Invesco FTSE RAFI Emerging Markets ETF
PXI,Invesco Dorsey Wright Energy Momentum ETF
PXJ,Invesco Oil & Gas Services ETF
PXLW,"Pixelworks, Inc. - Common Stock"
PXS,Pyxis Tankers Inc. - Common Stock
PXSAW,Pyxis Tankers Inc. - Warrant
PY,Principal Value ETF
PYCR,"Paycor HCM, Inc. - Common Stock"
PYLD,PIMCO U.S. Treasury Index Fund PIMCO Multisector Bond Active Exchange-Traded Fund
PYN,PIMCO New York Municipal Income Fund III Common Shares of Beneficial Interest
PYPD,PolyPid Ltd. - Ordinary Shares
PYPL,"PayPal Holdings, Inc. - Common Stock"
PYPY,Tidal Trust II YieldMax PYPL Option Income Strategy ETF
PYT,PPlus Tr GSC-2 Tr Ctf Fltg Rate
PYXS,"Pyxis Oncology, Inc. - Common Stock"
PYZ,Invesco Dorsey Wright Basic Materials Momentum ETF
PZA,Invesco National AMT-Free Municipal Bond ETFo
PZC,PIMCO California Municipal Income Fund III Common Shares of Beneficial Interest
PZG,Paramount Gold Nevada Corp. Common Stock
PZT,Invesco New York AMT-Free Municipal Bond ETF
PZZA,"Papa John's International, Inc. - Common Stock"
QABA,First Trust NASDAQ ABA Community Bank Index Fund
QAI,NYLI Hedge Multi-Strategy Tracker ETF
QARP,Xtrackers Russell 1000 US Quality at a Reasonable Price ETF ETF
QAT,iShares MSCI Qatar ETF
QBER,Elevation Series Trust TrueShares Quarterly Bear Hedge ETF
QBTS,D-Wave Quantum Inc. Common Shares
QBTS.W,"D-Wave Quantum Inc. Warrants, each whole warrant exercisable for 1.4541326 Common Shares at an exercise price of $11.50"
QBUF,Innovator Nasdaq-100 10 Buffer ETF Quarterly
QBUL,Elevation Series Trust TrueShares Quarterly Bull Hedge ETF
QCAP,First Trust Exchange-Traded Fund VIII FT Vest Nasdaq-100 Conservative Buffer ETF - April
QCJL,First Trust Exchange-Traded Fund VIII FT Vest Nasdaq-100 Conservative Buffer ETF - July
QCLN,First Trust NASDAQ Clean Edge Green Energy Index Fund
QCLR,Global X NASDAQ 100 Collar 95-110 ETF
QCOC,First Trust Exchange-Traded Fund VIII FT Vest Nasdaq-100 Conservative Buffer ETF - October
QCOM,QUALCOMM Incorporated - Common Stock
QCON,American Century ETF Trust American Century Quality Convertible Securities ETF
QCRH,"QCR Holdings, Inc. - Common Stock"
QD,"Qudian Inc. American Depositary Shares, each representing one Class A Ordinary Share"
QDCC,Global X Funds Global X S&P 500 Quality Dividend Covered Call ETF
QDEC,FT Vest Nasdaq-100 Buffer ETF - December
QDEF,FlexShares Quality Dividend Defensive Index Fund
QDEL,QuidelOrtho Corporation - Common Stock
QDF,FlexShares Quality Dividend Index Fund
QDIV,Global X S&P 500 Quality Dividend ETF
QDPL,Pacer Metaurus US Large Cap Dividend Multiplier 400 ETF
QDTE,Roundhill Innovation-100 0DTE Covered Call Strategy ETF
QDVO,Amplify ETF Trust Amplify CWP Growth & Income ETF
QEFA,SPDR MSCI EAFE StrategicFactors ETF
QEMM,SPDR MSCI Emerging Markets StrategicFactors ETF
QETA,Quetta Acquisition Corporation - Common Stock
QETAR,Quetta Acquisition Corporation - Right
QETAU,Quetta Acquisition Corporation - Unit
QETH,Invesco Galaxy Ethereum ETF Invesco Galaxy Ethereum ETF
QFIN,"Qifu Technology, Inc - American Depositary Shares"
QFLR,Innovator ETFs Trust Innovator Nasdaq-100 Managed Floor ETF
QGEN,Qiagen N.V. Common Shares
QGRO,American Century U.S. Quality Growth ETF
QGRW,WisdomTree Trust WisdomTree U.S. Quality Growth Fund
QH,Quhuo Limited - American Depository Shares
QHDG,Innovator Hedged Nasdaq-100 ETF
QHY,WisdomTree U.S. High Yield Corporate Bond Fund
QID,ProShares UltraShort QQQ
QIG,WisdomTree U.S. Corporate Bond Fund
QINT,American Century Quality Diversified International ETF
QIPT,Quipt Home Medical Corp. - Common Shares
QIS,Simplify Exchange Traded Funds Simplify Multi-QIS Alternative ETF
QJUN,FT Vest Nasdaq-100 Buffer ETF - June
QLC,FlexShares Trust FlexShares US Quality Large Cap Index Fund
QLD,ProShares Ultra QQQ
QLGN,"Qualigen Therapeutics, Inc. - Common Stock"
QLTA,iShares Aaa A Rated Corporate Bond ETF
QLTI,The 2023 ETF Series Trust II GMO International Quality ETF
QLTY,The 2023 ETF Series Trust II GMO U.S. Quality ETF
QLV,FlexShares US Quality Low Volatility Index Fund
QLVD,FlexShares Developed Markets ex-US Quality Low Volatility Index Fund
QLVE,FlexShares Emerging Markets  Quality Low Volatility Index Fund
QLYS,"Qualys, Inc. - Common Stock"
QMAG,First Trust Exchange-Traded Fund VIII FT Vest Nasdaq-100 Moderate Buffer ETF - August
QMAR,FT Vest Nasdaq-100 Buffer ETF - March
QMCO,Quantum Corporation - Common Stock
QMID,WisdomTree U.S. MidCap Quality Growth Fund
QMMM,QMMM Holdings Limited - Ordinary Shares
QMMY,First Trust Exchange-Traded Fund VIII FT Vest Nasdaq-100 Moderate Buffer ETF - May
QMOM,Alpha Architect U.S. Quantitative Momentum ETF
QNCX,"Quince Therapeutics, Inc. - Common Stock"
QNRX,"Quoin Pharmaceuticals, Ltd. - American Depositary Shares"
QNST,"QuinStreet, Inc. - Common Stock"
QNTM,Quantum Biopharma Ltd. - Class B Subordinate Voting Shares
QNXT,iShares Nasdaq-100 ex Top 30 ETF
QOMO,Qomolangma Acquisition Corp. - Common Stock
QOMOR,Qomolangma Acquisition Corp. - Right
QOMOU,Qomolangma Acquisition Corp. - Unit
QOMOW,Qomolangma Acquisition Corp. - Warrant
QOWZ,Invesco Nasdaq Free Cash Flow Achievers ETF
QPFF,American Century ETF Trust American Century Quality Preferred ETF
QPX,AdvisorShares Q Dynamic Growth ETF
QQA,Invesco QQQ Income Advantage ETF
QQEW,First Trust NASDAQ-100 Equal Weighted Index Fund
QQH,HCM Defender 100 Index ETF
QQJG,Invesco ESG NASDAQ Next Gen 100 ETF
QQMG,Invesco ESG NASDAQ 100 ETF
QQQ,"Invesco QQQ Trust, Series 1"
QQQA,ProShares Nasdaq-100 Dorsey Wright Momentum ETF
QQQD,Direxion Daily Magnificent 7 Bear 1X Shares
QQQE,Direxion NASDAQ-100 Equal Weighted Index Shares
QQQG,Pacer Nasdaq 100 Top 50 Cash Cows Growth Leaders ETF
QQQI,NEOS Nasdaq 100 High Income ETF
QQQJ,Invesco NASDAQ Next Gen 100 ETF
QQQM,Invesco NASDAQ 100 ETF
QQQP,Tradr 2X Long Triple Q Quarterly ETF
QQQS,Invesco NASDAQ Future Gen 200 ETF
QQQT,Defiance Nasdaq 100 Income Target ETF
QQQU,Direxion Daily Magnificent 7 Bull 2X Shares
QQQW,Tradr 2X Long Triple Q Weekly ETF
QQQX,Nuveen NASDAQ 100 Dynamic Overwrite Fund - Closed End Fund
QQQY,Defiance Nasdaq 100 Enhanced Options & 0DTE Income ETF
QQXT,First Trust NASDAQ-100 Ex-Technology Sector Index Fund
QRFT,QRAFT AI-Enhanced U.S. Large Cap ETF
QRHC,Quest Resource Holding Corporation - Common Stock
QRMI,Global X NASDAQ 100 Risk Managed Income ETF
QRTEA,"Qurate Retail, Inc. - Series A Common Stock"
QRTEB,"Qurate Retail, Inc. - Series B Common Stock"
QRTEP,"Qurate Retail, Inc. - 8.0% Fixed Rate Cumulative Redeemable Preferred Stock"
QRVO,"Qorvo, Inc. - Common Stock"
QS,QuantumScape Corporation Class A Common Stock
QSG,QuantaSing Group Limited - American Depositary Shares
QSI,Quantum-Si Incorporated - Class A Common Stock
QSIAW,Quantum-Si Incorporated - Warrant
QSIG,WisdomTree U.S. Short Term Corporate Bond Fund
QSIX,Pacer Metaurus Nasdaq 100 Dividend Multiplier 600 ETF
QSML,WisdomTree U.S. SmallCap Quality Growth Fund
QSPT,FT Vest Nasdaq-100 Buffer ETF - September
QSR,Restaurant Brands International Inc. Common Shares
QSWN,Amplify ETF Trust Amplify BlackSwan Tech & Treasury ETF
QTAP,Innovator Growth Accelerated Plus ETF - April
QTEC,First Trust NASDAQ-100-Technology Sector Index Fund
QTI,"QT Imaging Holdings, Inc. - Common Stock"
QTJA,Innovator ETFs Trust Innovator Growth Accelerated Plus ETF - January
QTJL,Innovator Growth Accelerated Plus ETF - July
QTOC,Innovator Growth Accelerated Plus ETF - October
QTOP,iShares Nasdaq Top 30 Stocks ETF
QTR,Global X NASDAQ 100 Tail Risk ETF
QTRX,Quanterix Corporation - Common Stock
QTTB,Q32 Bio Inc. - Common Stock
QTUM,Defiance Quantum ETF
QTWO,"Q2 Holdings, Inc. Common Stock"
QUAD,"Quad Graphics, Inc Class A Common Stock"
QUAL,iShares MSCI USA Quality Factor ETF
QUBT,Quantum Computing Inc. - Common Stock
QUIK,QuickLogic Corporation - Common Stock
QULL,ETRACS 2x Leveraged MSCI US Quality Factor TR ETN
QURE,uniQure N.V. - Ordinary Shares
QUS,SPDR MSCI USA StrategicFactors ETF
QUVU,Hartford Funds Exchange-Traded Trust Hartford Quality Value ETF
QVAL,Alpha Architect U.S. Quantitative Value ETF
QVCC,"QVC, Inc. 6.250% Senior Secured Notes due 2068"
QVCD,"QVC, Inc. 6.375% Senior Secured Notes due 2067"
QVML,Invesco S&P 500 QVM Multi-factor ETF
QVMM,Invesco S&P MidCap 400 QVM Multi-factor ETF
QVMS,Invesco S&P SmallCap 600 QVM Multi-factor ETF
QVOY,Q3 All-Season Active Rotation ETF Q3 All-Season Active Rotation ETF
QWLD,SPDR MSCI World StrategicFactors ETF
QXO,"QXO, Inc.  - Common Stock"
QXQ,SGI Enhanced Nasdaq-100 ETF
QYLD,Global X NASDAQ 100 Covered Call ETF
QYLE,Global X Nasdaq 100 ESG Covered Call ETF
QYLG,Global X Nasdaq 100 Covered Call & Growth ETF
R,"Ryder System, Inc. Common Stock"
RA,Brookfield Real Assets Income Fund Inc. Common Stock
RAAX,VanEck Inflation Allocation ETF
RACE,Ferrari N.V. Common Shares
RAFE,PIMCO RAFI ESG U.S. ETF
RAIL,"Freightcar America, Inc. - Common Stock"
RAMP,"LiveRamp Holdings, Inc. Common Stock"
RAND,Rand Capital Corporation - Closed End Fund
RANI,"Rani Therapeutics Holdings, Inc. - Class A Common Stock"
RAPP,"Rapport Therapeutics, Inc. - Common Stock"
RAPT,"RAPT Therapeutics, Inc. - Common Stock"
RARE,Ultragenyx Pharmaceutical Inc. - Common Stock
RATE,Global X Funds Global X Interest Rate Hedge ETF
RAVE,"Rave Restaurant Group, Inc. - Common Stock"
RAVI,FlexShares Ultra-Short Income Fund
RAY,Raytech Holding Limited - ordinary shares
RAYA,Erayak Power Solution Group Inc. - Class A Ordinary Shares
RAYC,Rayliant Quantamental China Equity ETF
RAYD,The Advisors' Inner Circle Fund III Rayliant Quantitative Developed Market Equity ETF
RAYE,Rayliant Quantamental Emerging Market ex-China Equity ETF
RAYJ,The Advisors' Inner Circle Fund III Rayliant SMDAM Japan Equity ETF
RAYS,Global X Solar ETF
RBA,"RB Global, Inc. Common Stock"
RBB,RBB Bancorp - Common Stock
RBBN,Ribbon Communications Inc.  - Common Stock
RBC,RBC Bearings Incorporated Common Stock
RBCAA,"Republic Bancorp, Inc. - Class A Common Stock"
RBKB,"Rhinebeck Bancorp, Inc. - Common Stock"
RBLD,First Trust Alerian US NextGen Infrastructure ETF
RBLX,Roblox Corporation Class A Common Stock
RBOT,Vicarious Surgical Inc. Class A Common Stock
RBOT.W,"Vicarious Surgical Inc. Warrants, each whole warrant exercisable for one share of Class A Common Stock at an exercise price of $11.50 per share"
RBRK,"Rubrik, Inc. Class A Common Stock"
RBUF,SHL Telemedicine Ltd Innovator U.S. Small Cap 10 Buffer ETF - Quarterly
RC,Ready Capital Corporation Common Stock
RC$C,Ready Capital Corporation 6.25% Series C Cumulative Convertible Preferred Stock
RC$E,Ready Capital Corporation 6.50% Series E Cumulative Redeemable Preferred Stock
RCAT,"Red Cat Holdings, Inc. - Common Stock"
RCB,Ready Capital Corporation 6.20% Senior Notes due 2026
RCC,Ready Capital Corporation 5.75% Senior Notes due 2026
RCEL,"Avita Medical, Inc. - Common Stock"
RCFA,Perception Capital Corp. IV Class A Ordinary Shares
RCFA.U,"Perception Capital Corp. IV Units, each consisting of one Class A ordinary share and one-half of one redeemable warrant"
RCFA.W,"Perception Capital Corp. IV Warrants, each whole warrant exercisable for one Class A ordinary share at an exercise price of $11.50 per share"
RCG,"RENN Fund, Inc Common Stock"
RCI,"Rogers Communication, Inc. Common Stock"
RCKT,"Rocket Pharmaceuticals, Inc. - Common Stock"
RCKTW,"Rocket Pharmaceuticals, Inc. - Warrant"
RCKY,"Rocky Brands, Inc. - Common Stock"
RCL,Royal Caribbean Cruises Ltd. Common Stock
RCM,R1 RCM Inc. - Common Stock
RCMT,"RCM Technologies, Inc. - Common Stock"
RCON,"Recon Technology, Ltd. - Class A Ordinary Shares"
RCS,"PIMCO Strategic Income Fund, Inc."
RCUS,"Arcus Biosciences, Inc. Common Stock"
RDACU,Rising Dragon Acquisition Corp. - Unit
RDCM,Radcom Ltd. - Ordinary Shares
RDDT,"Reddit, Inc. Class A Common Stock"
RDFI,Rareview Dynamic Fixed Income ETF
RDFN,Redfin Corporation - Common Stock
RDHL,Redhill Biopharma Ltd. - American Depositary Shares
RDI,Reading International Inc - Class A Non-voting Common Stock
RDIB,Reading International Inc - Class B Voting Common Stock
RDIV,Invesco Exchange-Traded Fund Trust II Invesco S&P Ultra Dividend Revenue ETF
RDN,Radian Group Inc. Common Stock
RDNT,"RadNet, Inc. - Common Stock"
RDOG,ALPS ETF Trust ALPS REIT Dividend Dogs ETF
RDTE,Roundhill ETF Trust Roundhill Small Cap 0DTE Covered Call Strategy ETF
RDUS,"Radius Recycling, Inc. - Class A Common Stock"
RDVI,FT Vest Rising Dividend Achievers Target Income ETF
RDVT,"Red Violet, Inc. - Common Stock "
RDVY,First Trust Rising Dividend Achievers ETF
RDW,Redwire Corporation Common Stock
RDW.W,Redwire Corporation Redeemable Warrants
RDWR,Radware Ltd. - Ordinary Shares
RDY,Dr. Reddy's Laboratories Ltd Common Stock
RDZN,"Roadzen, Inc. - Ordinary Shares"
RDZNW,"Roadzen, Inc. - Warrants"
REAI,Intelligent Real Estate ETF
REAL,"The RealReal, Inc. - Common Stock"
REAX,"The Real Brokerage, Inc. - Common Shares"
REBN,"Reborn Coffee, Inc. - Common Stock"
RECS,Columbia Research Enhanced Core ETF
RECT,Rectitude Holdings Ltd - Ordinary Shares
REE,REE Automotive Ltd. - Class A Ordinary Shares
REET,iShares Trust iShares Global REIT ETF
REFI,"Chicago Atlantic Real Estate Finance, Inc. - Common Stock"
REFR,Research Frontiers Incorporated - Common Stock
REG,Regency Centers Corporation - Common Stock
REGCO,Regency Centers Corporation - 5.875% Series B Cumulative Redeemable Preferred Stock
REGCP,Regency Centers Corporation - 6.25% Series A Cumulative Redeemable Preferred Stock
REGL,ProShares S&P MidCap 400 Dividend Aristocrats ETF
REGN,"Regeneron Pharmaceuticals, Inc. - Common Stock"
REI,"Ring Energy, Inc. Common Stock"
REIT,ALPS Active REIT ETF
REK,ProShares Short Real Estate
REKR,"Rekor Systems, Inc. - Common Stock"
REKT,Direxion Shares ETF Trust Direxion Daily Crypto Industry Bear 1X Shares
RELI,"Reliance Global Group, Inc. - Common Stock"
RELIW,"Reliance Global Group, Inc. - Series A Warrants"
RELL,"Richardson Electronics, Ltd. - Common Stock"
RELX,RELX PLC PLC American Depositary Shares (Each representing One Ordinary Share)
RELY,"Remitly Global, Inc. - Common stock"
REM,iShares Trust iShares Mortgage Real Estate ETF
REMX,VanEck Rare Earth and Strategic Metals ETF
RENB,Renovaro Inc. - Common Stock
RENE,Cartesian Growth Corporation II - Class A Ordinary Shares
RENEU,Cartesian Growth Corporation II - Unit
RENEW,Cartesian Growth Corporation II - Warrant
RENT,"Rent the Runway, Inc. - Class A Common Stock"
