Symbol,Security Name
IXHL,Incannex Healthcare Inc. - Common Stock
IXJ,iShares Global Healthcare ETF
IXN,iShares Global Tech ETF
IXP,iShares Global Comm Services ETF
IXUS,iShares Core MSCI Total International Stock ETF
IYC,iShares U.S. Consumer Discretionary ETF
IYE,iShares U.S. Energy ETF
IYF,iShares U.S. Financial ETF
IYG,iShares U.S. Financial Services ETF
IYH,iShares U.S. Healthcare ETF
IYJ,iShares U.S. Industrials ETF
IYK,iShares U.S. Consumer Staples ETF
IYLD,iShares Morningstar Multi-Asset Income ETF
IYM,iShares U.S. Basic Materials ETF
IYR,iShares U.S. Real Estate ETF
IYT,iShares Trust iShares U.S. Transportation ETF
IYW,iShares U.S. Technology ETF
IYY,iShares Dow Jones U.S. ETF
IYZ,iShares U.S. Telecommunications ETF
IZEA,"IZEA Worldwide, Inc. - Common Stock"
IZM,ICZOOM Group Inc. - Class A Ordinary Shares
IZRL,ARK Israel Innovative Technology ETF
IZTC,Invizyne Technologies Inc. - Common Stock
J,Jacobs Solutions Inc. Common Stock
JAAA,Janus Henderson AAA CLO ETF
JACK,Jack In The Box Inc. - Common Stock
JADE,J.P. Morgan Exchange-Traded Fund Trust JPMorgan Active Developing Markets Equity ETF
JAGX,"Jaguar Health, Inc. - Common Stock"
JAJL,SHL Telemedicine Ltd Innovator Equity Defined Protection ETF - 6mo Jan/Jul
JAKK,"JAKKS Pacific, Inc. - Common Stock"
JAMF,Jamf Holding Corp. - Common Stock
JAND,Innovator ETFs Trust Innovator Premium Income 10 Barrier ETF - January
JANH,Innovator ETFs Trust Innovator Premium Income 20 Barrier ETF - January
JANJ,Innovator ETFs Trust Innovator Premium Income 30 Barrier ETF - January
JANP,PGIM US Large-Cap Buffer 12 ETF - January
JANQ,Innovator ETFs Trust Innovator Premium Income 40 Barrier ETF - January
JANT,AllianzIM U.S. Large Cap Buffer10 Jan ETF
JANW,AllianzIM U.S. Large Cap Buffer20 Jan ETF
JANX,"Janux Therapeutics, Inc. - Common Stock"
JANZ,TrueShares Structured Outcome (January) ETF
JAVA,JPMorgan Active Value ETF
JAZZ,Jazz Pharmaceuticals plc - Ordinary Shares
JBBB,Janus Detroit Street Trust Janus Henderson B-BBB CLO ETF
JBDI,JBDI Holdings Limited - Ordinary Shares
JBGS,JBG SMITH Properties Common Shares 
JBHT,"J.B. Hunt Transport Services, Inc. - Common Stock"
JBI,"Janus International Group, Inc. Common Stock"
JBK,Lehman ABS 3.50 3.50% Adjustable Corp Backed Tr Certs GS Cap I
JBL,Jabil Inc. Common Stock
JBLU,JetBlue Airways Corporation - Common Stock
JBND,J.P. Morgan Exchange-Traded Fund Trust JPMorgan Active Bond ETF
JBSS,"John B. Sanfilippo & Son, Inc. - Common Stock"
JBT,John Bean Technologies Corporation Common Stock
JCE,Nuveen Core Equity Alpha Fund Common Shares of Beneficial Interest
JCHI,J.P. Morgan Exchange-Traded Fund Trust JPMorgan Active China ETF
JCI,Johnson Controls International plc Ordinary Share
JCPB,JPMorgan Core Plus Bond ETF
JCPI,J P MORGAN EXCHANGE-TRADED FD TR JPMorgan Inflation Managed Bond ETF
JCSE,JE Cleantech Holdings Limited - Ordinary Shares
JCTC,Jewett-Cameron Trading Company - Common Shares
JCTR,JPMorgan Carbon Transition U.S. Equity ETF
JD,"JD.com, Inc. - American Depositary Shares"
JDIV,J.P. Morgan Exchange-Traded Fund Trust JPMorgan Dividend Leaders ETF
JDOC,JPMorgan Healthcare Leaders ETF
JDST,Direxion Daily Junior Gold Miners Index Bear 2X Shares
JDVI,John Hancock Exchange-Traded Fund Trust John Hancock Disciplined Value International Select ETF
JDZG,JIADE LIMITED - Common stock
JEF,Jefferies Financial Group Inc. Common Stock
JELD,"JELD-WEN Holding, Inc. Common Stock"
JEMA,JPMorgan ActiveBuilders Emerging Markets Equity ETF
JEMB,Janus Detroit Street Trust Janus Henderson Emerging Markets Debt Hard Currency ETF
JEPI,JPMorgan Equity Premium Income ETF
JEPQ,JPMorgan Nasdaq Equity Premium Income ETF
JEQ,"abrdn Japan Equity Fund, Inc. Common Stock"
JETD,Bank Of Montreal MAX Airlines -3X Inverse Leveraged ETNs
JETS,U.S. Global Jets ETF
JETU,Bank Of Montreal MAX Airlines 3X Leveraged ETNs
JFBR,Jeffs' Brands Ltd - Ordinary Shares
JFBRW,Jeffs' Brands Ltd - Warrant
JFIN,Jiayin Group Inc. - American Depositary Shares
JFR,Nuveen Floating Rate Income Fund Common Stock
JFU,9F Inc. - American Depositary Shares
JFWD,Jacob Funds Inc. Jacob Forward ETF
JG,Aurora Mobile Limited - American Depositary Shares
JGH,Nuveen Global High Income Fund Common Shares of Beneficial Interest
JGLO,JPMorgan Global Select Equity ETF
JGRO,J.P. Morgan Exchange-Traded Fund Trust JPMorgan Active Growth ETF
JGRW,Trust for Professional Managers Jensen Quality Growth ETF
JHAC,John Hancock Exchange-Traded Fund Trust John Hancock Fundamental All Cap Core ETF
JHCB,John Hancock Corporate Bond ETF
JHDV,John Hancock Exchange-Traded Fund Trust John Hancock U.S. High Dividend ETF
JHEM,John Hancock Multifactor Emerging Markets ETF
JHG,Janus Henderson Group plc Ordinary Shares
JHHY,John Hancock Exchange-Traded Fund Trust John Hancock High Yield ETF
JHI,John Hancock Investors Trust Common Stock
JHID,John Hancock Exchange-Traded Fund Trust John Hancock International High Dividend ETF
JHMB,John Hancock Mortgage-Backed Securities ETF
JHMD,John Hancock Exchange-Traded Fund Trust John Hancock Multifactor Developed International ETF
JHML,John Hancock Multifactor Large Cap ETF
JHMM,John Hancock Multifactor Mid Cap ETF
JHMU,John Hancock Exchange-Traded Fund Trust John Hancock Dynamic Municipal Bond ETF
JHPI,John Hancock Exchange-Traded Fund Trust John Hancock Preferred Income ETF
JHS,John Hancock Income Securities Trust Common Stock
JHSC,John Hancock Multifactor Small Cap ETF
JHX,James Hardie Industries plc American Depositary Shares (Ireland)
JIG,JPMorgan International Growth ETF
JIII,Janus Detroit Street Trust Janus Henderson Income ETF
JILL,"J. Jill, Inc. Common Stock"
JIRE,J.P. Morgan Exchange-Traded Fund Trust JPMorgan International Research Enhanced Equity ETF
JIVE,JPMorgan International Value ETF
JJSF,J & J Snack Foods Corp. - Common Stock
JKHY,"Jack Henry & Associates, Inc. - Common Stock"
JKS,JinkoSolar Holding Company Limited American Depositary Shares (each representing 4 Common Shares)
JL,J-Long Group Limited - Ordinary Shares
JLL,Jones Lang LaSalle Incorporated Common Stock
JLQD,Janus Henderson Corporate Bond ETF
JLS,Nuveen Mortgage and Income Fund
JMBS,Janus Henderson Mortgage-Backed Securities ETF
JMEE,JPMorgan Small & Mid Cap Enhanced Equity ETF
JMHI,J.P. Morgan Exchange-Traded Fund Trust JPMorgan High Yield Municipal ETF
JMIA,"Jumia Technologies AG American Depositary Shares, each representing two Ordinary Shares"
JMID,Janus Henderson Mid Cap Growth Alpha ETF
JMM,Nuveen Multi-Market Income Fund (MA)
JMOM,JPMorgan U.S. Momentum Factor ETF
JMSB,"John Marshall Bancorp, Inc. - Common Stock"
JMSI,J.P. Morgan Exchange-Traded Fund Trust JPMorgan Sustainable Municipal Income ETF
JMST,JPMorgan Ultra-Short Municipal Income ETF
JMUB,JPMorgan Municipal ETF
JNEU,SHL Telemedicine Ltd AllianzIM U.S. Equity Buffer15 Uncapped June ETF
JNJ,Johnson & Johnson Common Stock
JNK,SPDR Bloomberg High Yield Bond ETF
JNPR,"Juniper Networks, Inc. Common Stock"
JNUG,Direxion Daily Junior Gold Miners Index Bull 2X Shares
JNVR,Janover Inc. - Common Stock
JOB,GEE Group Inc. Common Stock
JOBY,"Joby Aviation, Inc. Common Stock"
JOBY.W,"Joby Aviation, Inc. Warrants"
JOE,St. Joe Company (The) Common Stock
JOET,Virtus ETF Trust II Virtus Terranova U.S. Quality Momentum ETF
JOF,Japan Smaller Capitalization Fund Inc Common Stock
JOJO,ATAC Credit Rotation ETF
JOUT,Johnson Outdoors Inc. - Class A Common Stock
JPAN,Matthews International Funds Matthews Japan Active ETF
JPC,Nuveen Preferred & Income Opportunities Fund
JPEF,JPMorgan Equity Focus ETF
JPEM,JPMorgan Diversified Return Emerging Markets Equity ETF
JPI,Nuveen Preferred Securities & Income Opportunities Fund Common Shares
JPIB,J.P. Morgan Exchange-Traded Fund Trust JPMorgan International Bond Opportunities ETF
JPIE,JPMorgan Income ETF
JPIN,JPMorgan Diversified Return International Equity ETF
JPLD,J.P. Morgan Exchange-Traded Fund Trust JPMorgan Limited Duration Bond ETF
JPM,JP Morgan Chase & Co. Common Stock
JPM$C,"J P Morgan Chase & Co Depositary Shares, each representing a 1/400th interest in a share of 6.00% Non-Cumulative  Preferred Stock, Series EE"
JPM$D,"J P Morgan Chase & Co Depositary Shares, each representing a 1/400th  interest in a share of 5.75% Non-Cumulative  Preferred Stock, Series DD"
JPM$J,"J P Morgan Chase & Co Depositary Shares, each representing a 1/400th interest in a share of JPMorgan Chase & Co. 4.75% Non-Cumulative Preferred Stock, Series GG"
JPM$K,"J P Morgan Chase & Co Depositary Shares, each representing a 1/400th interest in a share of 4.55% Non-Cumulative Preferred Stock, Series JJ"
JPM$L,"J P Morgan Chase & Co Depositary Shares, each representing a 1/400th interest in a share of 4.625% Non-Cumulative Preferred Stock, Series LL"
JPM$M,"J P Morgan Chase & Co Depositary Shares, each representing a 1/400th interest in a share of 4.20% Non-Cumulative Preferred Stock, Series MM"
JPMB,JPMorgan USD Emerging Markets Sovereign Bond ETF
JPME,JPMorgan Diversified Return U.S. Mid Cap Equity ETF
JPMO,Tidal Trust II YieldMax JPM Option Income Strategy ETF
JPRE,J.P. Morgan Exchange-Traded Fund Trust JPMorgan Realty Income ETF
JPSE,JPMorgan Diversified Return U.S. Small Cap Equity ETF
JPST,JPMorgan Ultra-Short Income ETF
JPSV,J.P. Morgan Exchange-Traded Fund Trust JPMorgan Active Small Cap Value ETF
JPUS,JPMorgan Diversified Return U.S. Equity ETF
JPXN,iShares JPX-Nikkei 400 ETF
JQC,Nuveen Credit Strategies Income Fund Shares of Beneficial Interest
JQUA,JPMorgan U.S. Quality Factor ETF
JRE,Janus Henderson U.S. Real Estate ETF
JRI,Nuveen Real Asset Income and Growth Fund Common Shares of Beneficial Interest
JRS,Nuveen Real Estate Income Fund Common Shares of Beneficial Interest
JRSH,"Jerash Holdings (US), Inc. - Common Stock"
JRVR,"James River Group Holdings, Ltd. - Common Shares"
JSCP,JPMorgan Short Duration Core Plus ETF
JSI,Janus Detroit Street Trust Janus Henderson Securitized Income ETF
JSM,"Navient Corporation - 6% Senior Notes due December 15, 2043"
JSMD,Janus Henderson Small/Mid Cap Growth Alpha ETF
JSML,Janus Henderson Small Cap Growth Alpha ETF
JSPR,"Jasper Therapeutics, Inc. - Class A Common Stock"
JSPRW,"Jasper Therapeutics, Inc. - Warrant"
JSTC,Adasina Social Justice All Cap Global ETF
JTAI,Jet.AI Inc. - Common Stock
JTEK,JPMorgan U.S. Tech Leaders ETF
JUCY,ETF Series Solutions Aptus Enhanced Yield ETF
JULD,Innovator ETFs Trust Innovator Premium Income 10 Barrier ETF - July
JULH,Innovator ETFs Trust Innovator Premium Income 20 Barrier ETF - July
JULJ,Innovator ETFs Trust Innovator Premium Income 30 Barrier ETF - July
JULM,First Trust Exchange-Traded Fund VIII FT Vest U.S. Equity Max Buffer ETF - July
JULP,SHL Telemedicine Ltd PGIM US Large-Cap Buffer 12 ETF - July
JULQ,Innovator ETFs Trust Innovator Premium Income 40 Barrier ETF - July
JULT,AllianzIM U.S. Large Cap Buffer10 Jul ETF
JULU,SHL Telemedicine Ltd AllianzIM U.S. Equity Buffer15 Uncapped Jul ETF
JULW,AllianzIM U.S. Large Cap Buffer20 Jul ETF
JULZ,TrueShares Structured Outcome (July) ETF
JUNE,Junee Limited - Ordinary Shares
JUNM,SHL Telemedicine Ltd FT Vest U.S. Equity Max Buffer ETF - June
JUNP,SHL Telemedicine Ltd PGIM US Large-Cap Buffer 12 ETF - June
JUNT,AIM ETF Products Trust AllianzIM U.S. Large Cap Buffer10 Jun ETF
JUNW,AIM ETF Products Trust AllianzIM U.S. Large Cap Buffer20 Jun ETF
JUNZ,TrueShares Structured Outcome (June) ETF
JUST,Goldman Sachs JUST U.S. Large Cap Equity ETF
JVA,"Coffee Holding Co., Inc. - Common Stock"
JVAL,JPMorgan U.S. Value Factor ETF
JVSA,JVSPAC Acquisition Corp. - Class A Ordinary Share
JVSAR,JVSPAC Acquisition Corp. - Right
JVSAU,JVSPAC Acquisition Corp. - Unit
JWEL,Jowell Global Ltd. - Ordinary Shares
JWN,"Nordstrom, Inc. Common Stock"
JXI,iShares Global Utilities ETF
JXJT,JX Luxventure Limited - Common Stock
JXN,Jackson Financial Inc. Class A Common Stock 
JXN$A,"Jackson Financial Inc. Depositary Shares, each representing a 1/1,000th interest in a share of Fixed-Rate Reset Noncumulative Perpetual Preferred Stock, Series A"
JYD,Jayud Global Logistics Limited - Class A Ordinary Shares
JYNT,The Joint Corp. - Common Stock
JZ,Jianzhi Education Technology Group Company Limited - American Depositary Shares
JZXN,"Jiuzi Holdings, Inc. - Ordinary Shares"
K,Kellanova Common Stock
KACL,Kairous Acquisition Corp. Limited - Ordinary Shares
KACLR,Kairous Acquisition Corp. Limited - Rights
KACLU,Kairous Acquisition Corp. Limited - Unit
KACLW,Kairous Acquisition Corp. Limited - Warrants
KAI,Kadant Inc Common Stock
KALA,"KALA BIO, Inc. - Common Stock"
KALL,KraneShares MSCI All China Index ETF
KALU,Kaiser Aluminum Corporation - Common Stock
KALV,"KalVista Pharmaceuticals, Inc. - Common Stock"
KAPA,"Kairos Pharma, Ltd. Common Stock"
KAPR,Innovator U.S. Small Cap Power Buffer ETF - April
KAR,"OPENLANE, Inc. Common Stock"
KARO,Karooooo Ltd. - Ordinary shares
KARS,KraneShares Electric Vehicles and Future Mobility Index ETF
KAUG,Innovator ETFs Trust Innovator US Small Cap Power Buffer ETF - August
KAVL,"Kaival Brands Innovations Group, Inc. - Common Stock"
KB,KB Financial Group Inc
KBA,KraneShares Bosera MSCI China A 50 Connect Index ETF
KBDC,"Kayne Anderson BDC, Inc. Common Stock"
KBE,SPDR S&P Bank ETF
KBH,KB Home Common Stock
KBR,"KBR, Inc. Common Stock"
KBUF,KraneShares Trust KraneShares 90% KWEB Defined Outcome January 2026 ETF
KBWB,Invesco KBW Bank ETF
KBWD,Invesco KBW High Dividend Yield Financial ETF
KBWP,Invesco KBW Property & Casualty Insurance ETF
KBWR,Invesco KBW Regional Banking ETF
KBWY,Invesco KBW Premium Yield Equity REIT ETF
KC,Kingsoft Cloud Holdings Limited - American Depositary Shares
KCAI,KraneShares Trust KraneShares China Alpha Index ETF
KCCA,KraneShares California Carbon Allowance Strategy ETF
KCE,SPDR S&P Capital Markets ETF
KCSH,KraneShares Trust KraneShares Sustainable Ultra Short Duration Index ETF
KD,"Kyndryl Holdings, Inc. Common Stock"
KDLY,"Kindly MD, Inc. - Common Stock"
KDLYW,"Kindly MD, Inc. - Warrants"
KDP,Keurig Dr Pepper Inc. - Common Stock
KDRN,ETF Opportunities Trust Kingsbarn Tactical Bond ETF
KE,"Kimball Electronics, Inc. - Common Stock"
KEAT,Keating Active ETF
KELYA,"Kelly Services, Inc. - Class A Common Stock"
KELYB,"Kelly Services, Inc. - Class B Common Stock"
KEM,KraneShares Trust KraneShares Dynamic Emerging Markets Strategy ETF
KEMQ,KraneShares Emerging Markets Consumer Technology Index ETF
KEMX,KraneShares MSCI Emerging Markets ex China Index ETF
KEN,Kenon Holdings Ltd. Ordinary Shares
KEP,Korea Electric Power Corporation Common Stock
KEQU,Kewaunee Scientific Corporation - Common Stock
KEUA,KraneShares European Carbon Allowance Strategy ETF
KEX,Kirby Corporation Common Stock
KEY,KeyCorp Common Stock
KEY$I,"KeyCorp Depositary Shares Each Representing a 1/40th Ownership Interest in a Share of Fixed-to-Floating Rate Perpetual Non-Cumulative Preferred Stock, Series E"
KEY$J,"KeyCorp Depositary Shares each representing a 1/40th ownership interest in a share of Fixed Rate Perpetual Non-Cumulative Preferred Stock, Series F"
KEY$K,"KeyCorp Depositary Shares, each representing a 1/40th ownership interest in a share of Fixed Rate Perpetual Non-Cumulative Preferred Stock, Series G"
KEY$L,"KeyCorp Depositary Shares each representing a 1/40th ownership interest in a share of Fixed Rate Perpetual Non-Cumulative Preferred Stock, Series H"
KEYS,Keysight Technologies Inc. Common Stock
KF,"Korea Fund, Inc. (The) New Common Stock"
KFFB,Kentucky First Federal Bancorp - Common Stock
KFRC,"Kforce, Inc. Common Stock"
KFS,"Kingsway Financial Services, Inc. Common Stock (DE)"
KFY,Korn Ferry Common Stock
KGC,Kinross Gold Corporation Common Stock
KGEI,Kolibri Global Energy Inc. - Common stock
KGRN,KraneShares MSCI China Clean Technology Index ETF
KGS,"Kodiak Gas Services, Inc. Common Stock"
KHC,The Kraft Heinz Company - Common Stock
KHPI,Managed Portfolio Series Kensington Hedged Premium Income ETF
KHYB,KraneShares Asia Pacific High Income USD Bond ETF
KIDS,OrthoPediatrics Corp. - Common Stock
KIE,SPDR S&P Insurance ETF
KIM,Kimco Realty Corporation (HC) Common Stock
KIM$L,"Kimco Realty Corporation Class L Depositary Shares, each of which represents a one-one thousandth fractional interest in a share of 5.125% Class L Cumulative Redeemable Preferred Stock, liquidation preference $25,000.00 per share"
KIM$M,"Kimco Realty Corporation Class M Depositary Shares, each of which represents a one-one thousandth fractional interest in a share of 5.25% Class M Cumulative Redeemable Preferred Stock, liquidation preference $25,000.00 per share"
KIM$N,"Kimco Realty Corporation Depositary Shares, each representing 1/1,000th interest in a share of 7.25% Class N Cumulative Convertible Perpetual Preferred Stock"
KIND,"Nextdoor Holdings, Inc. Class A Common Stock"
KINS,"Kingstone Companies, Inc - Common Stock"
KIO,KKR Income Opportunities Fund Common Shares
KIRK,"Kirkland's, Inc. - Common Stock"
KITT,"Nauticus Robotics, Inc. - Common stock"
KITTW,"Nauticus Robotics, Inc. - Warrant"
KJAN,Innovator U.S. Small Cap Power Buffer ETF - January
KJUL,Innovator U.S. Small Cap Power Buffer ETF - July
KJUN,SHL Telemedicine Ltd Innovator U.S. Small Cap Power Buffer ETF - June
KKR,KKR & Co. Inc. Common Stock
KKRS,KKR Group Finance Co. IX LLC 4.625% Subordinated Notes due 2061
KLAC,KLA Corporation  - Common Stock
KLC,"KinderCare Learning Companies, Inc. Common Stock"
KLG,WK Kellogg Co Common Stock
KLIC,"Kulicke and Soffa Industries, Inc. - Common Stock"
KLIP,KraneShares Trust KraneShares China Internet and Covered Call Strategy ETF
KLMT,Invesco Exchange-Traded Fund Trust II Invesco MSCI Global Climate 500 ETF
KLTO,"Klotho Neurosciences, Inc. - Common Stock"
KLTOW,"Klotho Neurosciences, Inc. - Warrants"
KLTR,"Kaltura, Inc. - Common Stock"
KLXE,"KLX Energy Services Holdings, Inc.  - Common Stock"
KLXY,KraneShares Trust KraneShares Global Luxury Index ETF
KMB,Kimberly-Clark Corporation Common Stock
KMDA,Kamada Ltd. - Ordinary Shares
KMI,"Kinder Morgan, Inc. Common Stock"
KMID,Virtus ETF Trust II Virtus KAR Mid-Cap ETF
KMLM,KraneShares Mount Lucas Managed Futures Index Strategy ETF
KMPB,Kemper Corporation 5.875% Fixed-Rate Reset Junior Subordinated Debentures due 2062
KMPR,Kemper Corporation
KMT,Kennametal Inc. Common Stock
KMX,CarMax Inc
KN,Knowles Corporation Common Stock
KNCT,Invesco Next Gen Connectivity ETF
KNDI,"Kandi Technologies Group, Inc. - Ordinary Shares"
KNF,Knife Riv Holding Co. Common Stock
KNG,FT Vest S&P 500 Dividend Aristocrats Target Income ETF
KNGS,Roundhill ETF Trust Roundhill S&P Dividend Monarchs ETF
KNGZ,First Trust S&P 500 Diversified Dividend Aristocrats ETF
KNO,Investment Managers Series Trust II AXS Knowledge Leaders ETF
KNOP,KNOT Offshore Partners LP Common Units representing Limited Partner Interests
KNOV,Innovator ETFs Trust Innovator U.S. Small Cap Power Buffer ETF - November
KNOW,Fundamentals First ETF Fundamentals First ETF
KNSA,"Kiniksa Pharmaceuticals, Ltd. - Class A Ordinary Shares"
KNSL,"Kinsale Capital Group, Inc. Common Stock"
KNTK,Kinetik Holdings Inc. Class A Common Stock
KNW,"Know Labs, Inc. Common Stock"
KNX,Knight-Swift Transportation Holdings Inc.
KO,Coca-Cola Company (The) Common Stock
KOCG,NEOS ETF Trust FIS Knights of Columbus Global Belief ETF
KOCT,Innovator U.S. Small Cap Power Buffer ETF - October
KOD,Kodiak Sciences Inc - Common Stock
KODK,Eastman Kodak Company Common New
KOF,"Coca Cola Femsa S.A.B. de C.V.  American Depositary Shares, each representing 10 Units (each Unit consists of 3 Series B Shares and 5 Series L Shares)"
KOKU,Xtrackers MSCI Kokusai Equity ETF
KOLD,ProShares UltraShort Bloomberg Natural Gas
KOMP,SPDR S&P Kensho New Economies Composite ETF
KONG,ETF Opportunities Trust Formidable Fortress ETF
KOOL,Spinnaker ETF Series North Shore Equity Rotation ETF
KOP,Koppers Holdings Inc. Common Stock
KOPN,Kopin Corporation - Common Stock
KORE,"KORE Group Holdings, Inc. Common Stock"
KORP,American Century Diversified Corporate Bond ETF
KORU,Direxion Daily South Korea Bull 3X Shares
KOS,Kosmos Energy Ltd. Common Shares (DE)
KOSS,Koss Corporation - Common Stock
KPLT,"Katapult Holdings, Inc. - Common Stock"
KPLTW,"Katapult Holdings, Inc. - Warrant"
KPOP,JAKOTA K-Pop and Korean Entertainment ETF
KPRO,KraneShares Trust KraneShares 100% KWEB Defined Outcome January 2026 ETF
KPRX,"Kiora Pharmaceuticals, Inc.  - Common Stock"
KPTI,Karyopharm Therapeutics Inc. - Common Stock
KQQQ,Kurv Technology Titans Select ETF
KR,Kroger Company (The) Common Stock
KRBN,KraneShares Global Carbon Strategy ETF
KRC,Kilroy Realty Corporation Common Stock
KRE,SPDR S&P Regional Banking ETF
KREF,KKR Real Estate Finance Trust Inc. Common Stock
KREF$A,KKR Real Estate Finance Trust Inc. 6.50% Series A Cumulative Redeemable Preferred Stock
KRG,Kite Realty Group Trust Common Stock
KRKR,36Kr Holdings Inc. - American Depositary Shares
KRMA,Global X Conscious Companies ETF
KRMD,"KORU Medical Systems, Inc. - Common Stock"
KRNT,Kornit Digital Ltd. - Ordinary Shares
KRNY,Kearny Financial - Common Stock
KRO,Kronos Worldwide Inc Common Stock
KRON,"Kronos Bio, Inc. - Common Stock"
KROP,Global X AgTech & Food Innovation ETF
KROS,"Keros Therapeutics, Inc. - common stock"
KRP,Kimbell Royalty Partners Common Units Representing Limited Partner Interests
KRRO,"Korro Bio, Inc. - Common Stock"
KRT,Karat Packaging Inc. - Common Stock
KRUS,"Kura Sushi USA, Inc. - Class A Common Stock"
KRUZ,Series Portfolios Trust Unusual Whales Subversive Republican Trading ETF
KRYS,"Krystal Biotech, Inc. - Common Stock"
KSA,iShares Trust iShares MSCI Saudi Arabia ETF
KSCP,"Knightscope, Inc. - Class A Common Stock"
KSEA,KraneShares Trust KraneShares Rockefeller Ocean Engagement ETF
KSEP,Innovator U.S. Small Cap Power Buffer ETF - September
KSPI,Joint Stock Company Kaspi.kz - American Depository Shares
KSPY,KraneShares Trust KraneShares Hedgeye Hedged Equity Index ETF
KSS,Kohl's Corporation Common Stock
KSTR,KraneShares SSE STAR Market 50 Index ETF
KT,KT Corporation Common Stock
KTB,"Kontoor Brands, Inc. Common Stock "
KTCC,Key Tronic Corporation - Common Stock
KTEC,KraneShares Hang Seng TECH Index ETF
KTF,DWS Municipal Income Trust
KTH,Structures Products Cp 8% CorTS Issued by Peco Energy Cap Tr II Preferred Stock
KTN,Structured Products Corp 8.205% CorTS 8.205% Corporate Backed Trust Securities (CorTS)
KTOS,"Kratos Defense & Security Solutions, Inc. - Common Stock"
KTTA,Pasithea Therapeutics Corp. - Common Stock
KTTAW,Pasithea Therapeutics Corp. - Warrant
KUKE,"Kuke Music Holding Limited American Depositary Shares, each representing one Ordinary Share"
KULR,"KULR Technology Group, Inc. Common Stock"
KURA,"Kura Oncology, Inc. - Common Stock"
KURE,KraneShares MSCI All China Health Care Index ETF
KVAC,Keen Vision Acquisition Corporation - Ordinary Shares
KVACU,Keen Vision Acquisition Corporation - Units
KVACW,Keen Vision Acquisition Corporation - Warrant
KVHI,"KVH Industries, Inc. - Common Stock"
KVLE,KraneShares Value Line Dynamic Dividend Equity Index ETF
KVUE,Kenvue Inc. Common Stock
KVYO,"Klaviyo, Inc. Series A Common Stock"
KW,Kennedy-Wilson Holdings Inc. Common Stock
KWE,"KWESST Micro Systems Inc. - common stock, no R/S concurrent with offering"
KWEB,KraneShares Trust KraneShares CSI China Internet ETF
KWESW,KWESST Micro Systems Inc. - warrant
KWR,Quaker Houghton Common Stock
KWT,iShares Trust iShares MSCI Kuwait ETF
KXI,iShares Global Consumer Staples ETF
KXIN,Kaixin Holdings - Ordinary Shares
KYMR,"Kymera Therapeutics, Inc. - Common Stock"
KYN,"Kayne Anderson Energy Infrastructure Fund, Inc."
KYTX,"Kyverna Therapeutics, Inc. - Common Stock"
KZIA,Kazia Therapeutics Limited - American Depositary Shares
KZR,"Kezar Life Sciences, Inc. - Common Stock"
L,Loews Corporation Common Stock
LAAC,Lithium Americas (Argentina) Corp. Common Shares
LAB,Standard BioTools Inc. - Common Stock
LABD,Direxion Daily S&P Biotech Bear 3X Shares
LABU,Direxion Daily S&P Biotech Bull 3X Shares
LAC,Lithium Americas Corp. Common Shares
LAD,"Lithia Motors, Inc. Common Stock"
LADR,Ladder Capital Corp Class A Common Stock
LAES,SEALSQ Corp - Ordinary Shares
LAKE,"Lakeland Industries, Inc. - Common Stock"
LALT,First Trust Exchange-Traded Fund VIII First Trust Multi-Strategy Alternative ETF
LAMR,Lamar Advertising Company - Class A Common Stock
LANC,Lancaster Colony Corporation - Common Stock
LAND,Gladstone Land Corporation - Common Stock
LANDM,Gladstone Land Corporation - 5.00% Series D Cumulative Term Preferred Stock
LANDO,Gladstone Land Corporation - 6.00% Series B Cumulative Redeemable Preferred Stock
LANDP,Gladstone Land Corporation - 6.00% Series C Cumulative Redeemable Preferred Stock
LANV,Lanvin Group Holdings Limited Ordinary Shares
LANV.W,"Lanvin Group Holdings Limited Redeemable Warrants, each whole warrant exercisable for one Ordinary Share at an exercise price of $11.50"
LAPR,Innovator ETFs Trust Innovator Premium Income 15 Buffer ETF - April
LARK,Landmark Bancorp Inc. - Common Stock
LASE,Laser Photonics Corporation - Common Stock
LASR,"nLIGHT, Inc. - Common Stock"
LATG,Chenghe Acquisition I Co. - Class A Ordinary Shares
LATGU,Chenghe Acquisition I Co. - Units
LAUR,"Laureate Education, Inc. - Common Stock"
LAW,"CS Disco, Inc. Common Stock"
LAZ,"Lazard, Inc. Common Stock"
LAZR,"Luminar Technologies, Inc.  - Class A Common Stock"
LB,LandBridge Company LLC Class A Shares Representing Limited Liability Company Interests
LBAY,Leatherback Long/Short Alternative Yield ETF
LBGJ,Li Bang International Corporation Inc. - Ordinary Shares
LBO,EA Series Trust WHITEWOLF Publicly Listed Private Equity ETF
LBPH,"Longboard Pharmaceuticals, Inc. - Common Stock"
LBRDA,Liberty Broadband Corporation - Class A Common Stock
LBRDK,Liberty Broadband Corporation - Class C Common Stock
LBRDP,Liberty Broadband Corporation - Series A Cumulative Redeemable Preferred Stock
LBRT,Liberty Energy Inc. Class A common stock
LBTYA,Liberty Global Ltd. - Class A Common Shares
LBTYB,Liberty Global Ltd. - Class B Common Shares
LBTYK,Liberty Global Ltd. - Class C Common Shares
LC,LendingClub Corporation Common Stock
LCDS,JPMorgan Fundamental Data Science Large Core ETF
LCF,Touchstone ETF Trust Touchstone US Large Cap Focused ETF
