Symbol,Security Name
ED,"Consolidated Edison, Inc. Common Stock"
EDAP,"EDAP TMS S.A. - American Depositary Shares, each representing One Ordinary Share"
EDBL,Edible Garden AG Incorporated - Common Stock
EDBLW,Edible Garden AG Incorporated - Warrant
EDC,Direxion Emerging Markets Bull 3X Shares
EDD,"Morgan Stanley Emerging Markets Domestic Debt Fund, Inc. Common Stock"
EDEN,iShares Inc iShares MSCI Denmark ETF
EDF,Virtus Stone Harbor Emerging Markets Income Fund Common Shares of Beneficial Interest
EDGF,The Advisors Inner Circle Fund II 3EDGE Dynamic Fixed Income ETF
EDGH,The Advisors Inner Circle Fund II 3EDGE Dynamic Hard Assets ETF
EDGI,The Advisors Inner Circle Fund II 3EDGE Dynamic International Equity ETF
EDGU,The Advisors Inner Circle Fund II 3EDGE Dynamic US Equity ETF
EDIT,"Editas Medicine, Inc. - Common Stock"
EDIV,SPDR S&P Emerging Markets Dividend ETF
EDN,Empresa Distribuidora Y Comercializadora Norte S.A. (Edenor) American Depositary Shares
EDOC,Global X Telemedicine & Digital Health ETF
EDOG,ALPS Emerging Sector Dividend Dogs ETF
EDOW,First Trust Dow 30 Equal Weight ETF
EDR,"Endeavor Group Holdings, Inc. Class A Common Stock"
EDRY,EuroDry Ltd. - Common Shares
EDSA,"Edesa Biotech, Inc. - Common Shares"
EDTK,Skillful Craftsman Education Technology Limited - Ordinary Share
EDU,"New Oriental Education & Technology Group, Inc. Sponsored ADR representing 10 Ordinary Share (Cayman Islands)"
EDUC,Educational Development Corporation - Common Stock
EDV,Vanguard Extended Duration Treasury ETF
EDZ,Direxion Emerging Markets Bear 3X Shares
EE,"Excelerate Energy, Inc. Class A Common Stock"
EEA,"The European Equity Fund, Inc. Common Stock"
EEFT,"Euronet Worldwide, Inc. - Common Stock"
EEIQ,EpicQuest Education Group International Limited - Common Stock
EELV,Invesco S&P Emerging Markets Low Volatility ETF
EEM,iShares MSCI Emerging Index Fund
EEMA,iShares MSCI Emerging Markets Asia ETF
EEMO,Invesco S&P Emerging Markets Momentum ETF
EEMS,iShares MSCI Emerging Markets Small Cap ETF
EEMV,iShares MSCI Emerging Markets Min Vol Factor ETF
EEMX,SPDR MSCI Emerging Markets Fuel Reserves Free ETF
EES,WisdomTree U.S. SmallCap Fund
EET,ProShares Ultra MSCI Emerging Markets
EETH,ProShares Ether ETF
EEV,ProShares UltraShort MSCI Emerging Markets
EEX,"Emerald Holding, Inc. Common Stock"
EFA,iShares MSCI EAFE ETF
EFAA,Invesco Actively Managed Exchange-Traded Fund Trus Invesco MSCI EAFE Income Advantage ETF
EFAD,ProShares Trust ProShares MSCI EAFE Dividend Growers ETF
EFAS,Global X MSCI SuperDividend EAFE ETF
EFAV,iShares MSCI EAFE Min Vol Factor ETF
EFAX,SPDR MSCI EAFE Fossil Fuel Reserves Free ETF
EFC,Ellington Financial Inc. Common Stock 
EFC$A,Ellington Financial Inc. 6.750% Series A Fixed-to-Floating Rate Cumulative Redeemable Preferred Stock
EFC$B,Ellington Financial Inc. 6.250% Series B Fixed-Rate Reset Cumulative Redeemable Preferred Stock
EFC$C,Ellington Financial Inc. 8.625% Series C Fixed-Rate Reset Cumulative Redeemable Preferred Stock
EFC$D,Ellington Financial Inc. 7.00% Series D Cumulative Perpetual Redeemable Preferred Stock
EFC$E,Ellington Financial Inc. 8.250% Series E Fixed-to-Floating Rate Cumulative Redeemable Preferred Stock
EFG,iShares MSCI EAFE Growth ETF
EFIV,SPDR S&P 500 ESG ETF
EFIX,First Trust Exchange-Traded Fund VIII First Trust TCW Emerging Markets Debt ETF
EFNL,iShares Inc iShares MSCI Finland ETF
EFO,ProShares Ultra MSCI EAFE
EFOI,"Energy Focus, Inc. - Common Stock"
EFR,Eaton Vance Senior Floating-Rate Fund Common Shares of Beneficial Interest
EFRA,iShares Environmental Infrastructure and Industrials ETF
EFSC,Enterprise Financial Services Corporation - Common Stock
EFSCP,"Enterprise Financial Services Corporation - Depositary Shares Each Representing a 1/40th Interest in a Share of 5% Fixed Rate Non-Cumulative Perpetual Preferred Stock, Series A"
EFSH,1847 Holdings LLC Common Shares
EFT,Eaton Vance Floating Rate Income Trust Common Shares of Beneficial Interest
EFU,ProShares UltraShort MSCI EAFE
EFV,iShares MSCI EAFE Value ETF
EFX,"Equifax, Inc. Common Stock"
EFXT,Enerflex Ltd Common Shares
EFZ,ProShares Short MSCI EAFE
EG,"Everest Group, Ltd. Common Stock"
EGAN,eGain Corporation - Common Stock
EGBN,"Eagle Bancorp, Inc. - Common Stock"
EGF,"Blackrock Enhanced Government Fund, Inc. Common Stock"
EGHT,8x8 Inc - Common stock
EGO,Eldorado Gold Corporation Ordinary Shares
EGP,"EastGroup Properties, Inc. Common Stock"
EGUS,iShares Trust iShares ESG Aware MSCI USA Growth ETF
EGY,"VAALCO Energy, Inc.  Common Stock"
EH,EHang Holdings Limited - ADS
EHAB,"Enhabit, Inc. Common Stock"
EHC,Encompass Health Corporation Common Stock
EHGO,Eshallgo Inc. - Class A Ordinary Shares
EHI,Western Asset Global High Income Fund Inc Common Stock
EHLS,Even Herd Long Short ETF
EHTH,"eHealth, Inc. - Common Stock"
EIC,Eagle Point Income Company Inc. Common Stock
EICA,Eagle Point Income Company Inc. 5.00% Series A Term Preferred Stock due 2026
EICB,Eagle Point Income Company Inc. 7.75% Series B Term Preferred Stock Due 2028
EICC,Eagle Point Income Company Inc. 8.00% Series C Term Preferred Stock due 2029
EIDO,iShares MSCI Indonesia ETF
EIG,Employers Holdings Inc Common Stock
EIIA,Eagle Point Institutional Income Fund 8.125% Series A Term Preferred Shares Due 2029
EIM,"Eaton Vance Municipal Bond Fund Common Shares of Beneficial Interest, $.01 par value"
EINC,VanEck Energy Income ETF
EIPI,First Trust Exchange-Traded Fund VIII FT Energy Income Partners Enhanced Income ETF
EIPX,First Trust Exchange-Traded Fund IV FT Energy Income Partners Strategy ETF
EIRL,iShares Trust iShares MSCI Ireland ETF
EIS,iShares Inc iShares MSCI Israel ETF
EIX,Edison International Common Stock
EJAN,Innovator Emerging Markets Power Buffer ETF January
EJH,E-Home Household Service Holdings Limited - Ordinary shares
EJUL,Innovator Emerging Markets Power Buffer ETF July
EKG,First Trust Nasdaq Lux Digital Health Solutions ETF
EKSO,"Ekso Bionics Holdings, Inc. - Common Stock"
EL,"Estee Lauder Companies, Inc. (The) Common Stock"
ELA,Envela Corporation Common Stock
ELAB,"Elevai Labs, Inc. - Common Stock"
ELAN,Elanco Animal Health Incorporated Common Stock
ELBM,Electra Battery Materials Corporation - Common Stock
ELC,"Entergy Louisiana, Inc. Collateral Trust Mortgage Bonds, 4.875 % Series due September 1, 2066"
ELCV,Strategy Shares Eventide High Dividend ETF
ELD,WisdomTree Emerging Markets Local Debt Fund
ELDN,"Eledon Pharmaceuticals, Inc. - Common Stock"
ELEV,"Elevation Oncology, Inc. - Common stock"
ELF,"e.l.f. Beauty, Inc. Common Stock"
ELLO,Ellomay Capital Ltd Ordinary Shares (Israel)
ELMD,"Electromed, Inc. Common Stock"
ELME,Elme Communities Common Stock
ELP,Companhia Paranaense de Energia (COPEL) American Depositary Shares (each representing one Unit consisting one Common Share and four non-voting Class B Preferred Shares)
ELPC,Companhia Paranaense de Energia (COPEL) American Depositary Shares (each representing four (4) Common Shares)
ELQD,iShares ESG Advanced Investment Grade Corporate Bond ETF
ELS,"Equity Lifestyle Properties, Inc. Common Stock"
ELSE,"Electro-Sensors, Inc. - Common Stock"
ELTK,Eltek Ltd. - Ordinary Shares
ELTX,"Elicio Therapeutics, Inc. - Common Stock"
ELUT,"Elutia, Inc. - Class A Common Stock"
ELV,"Elevance Health, Inc. Common Stock"
ELVA,Electrovaya Inc. - Common Shares
ELVN,"Enliven Therapeutics, Inc.  - Common Stock"
ELWS,"Earlyworks Co., Ltd. - American Depositary Shares"
EM,Smart Share Global Limited - American Depositary Shares
EMB,iShares J.P. Morgan USD Emerging Markets Bond ETF
EMBC,Embecta Corp. - Common Stock
EMBD,Global X Emerging Markets Bond ETF
EMC,Global X Funds Global X Emerging Markets Great Consumer ETF
EMCB,WisdomTree Emerging Markets Corporate Bond Fund
EMCC,Global X Funds Global X MSCI Emerging Markets Covered Call ETF
EMCG,Embrace Change Acquisition Corp - Ordinary Shares
EMCGR,Embrace Change Acquisition Corp - Rights
EMCGU,Embrace Change Acquisition Corp - Units
EMCGW,Embrace Change Acquisition Corp - Warrants
EMCR,Xtrackers Emerging Markets Carbon Reduction and Climate Improvers ETF
EMCS,Xtrackers MSCI Emerging Markets Climate Selection ETF
EMD,Western Asset Emerging Markets Debt Fund Inc Common Stock
EMDM,First Trust Exchange-Traded Fund II First Trust Bloomberg Emerging Market Democracies ETF
EMDV,ProShares MSCI Emerging Markets Dividend Growers ETF
EME,"EMCOR Group, Inc. Common Stock"
EMEQ,Macquarie Focused Emerging Markets Equity ETF
EMF,Templeton Emerging Markets Fund Common Stock
EMGF,iShares Emerging Markets Equity Factor ETF
EMHC,SPDR Bloomberg Emerging Markets USD Bond ETF
EMHY,iShares J.P. Morgan EM High Yield Bond ETF
EMIF,iShares Emerging Markets Infrastructure ETF
EMKR,EMCORE Corporation - Common Stock
EML,Eastern Company (The) - Common Stock
EMLC,VanEck J. P. Morgan EM Local Currency Bond ET
EMLP,First Trust North American Energy Infrastructure Fund
EMM,Global X Funds Global X Emerging Markets ex-China ETF
EMMF,WisdomTree Emerging Markets Multifactor Fund
EMN,Eastman Chemical Company Common Stock
EMNT,PIMCO Enhanced Short Maturity Active ESG Exchange-Traded Fund
EMO,ClearBridge Energy Midstream Opportunity Fund Inc. Common Stock
EMOT,First Trust Exchange-Traded Fund VI First Trust S&P 500 Economic Moat ETF
EMP,"Entergy Mississippi, LLC First Mortgage Bonds, 4.90% Series Due October 1, 2066"
EMQQ,EMQQ The Emerging Markets Internet ETF
EMR,Emerson Electric Company Common Stock
EMSF,Matthews International Funds Matthews Emerging Markets Sustainable Future Active ETF
EMTL,SPDR DoubleLine Emerging Markets Fixed Income ETF
EMTY,ProShares Decline of the Retail Store ETF
EMX,EMX Royalty Corporation Common Shares (Canada)
EMXC,iShares MSCI Emerging Markets ex China ETF
EMXF,iShares ESG Advanced MSCI EM ETF
ENB,Enbridge Inc Common Stock
ENFN,"Enfusion, Inc. Class A Common Stock"
ENFR,Alerian Energy Infrastructure ETF
ENG,ENGlobal Corporation - Common Stock
ENGN,enGene Holdings Inc. - Common Stock
ENGNW,enGene Holdings Inc. - Warrants
ENIC,Enel Chile S.A. American Depositary Shares (Each representing 50 shares of Common Stock)
ENJ,"Entergy New Orleans, LLC First Mortgage Bonds, 5.0% Series due December 1, 2052"
ENLC,"EnLink Midstream, LLC Common Units representing Limited Partner Interests"
ENLT,Enlight Renewable Energy Ltd. - Ordinary Shares
ENLV,Enlivex Therapeutics Ltd. - Ordinary Shares
ENO,"Entergy New Orleans, LLC First Mortgage Bonds, 5.50% Series due April 1, 2066"
ENOR,iShares Inc iShares MSCI Norway ETF
ENOV,Enovis Corporation Common Stock
ENPH,"Enphase Energy, Inc. - Common Stock"
ENR,"Energizer Holdings, Inc. Common Stock"
ENS,EnerSys Common Stock
ENSC,"Ensysce Biosciences, Inc. - Common Stock"
ENSG,"The Ensign Group, Inc. - Common Stock"
ENTA,"Enanta Pharmaceuticals, Inc. - Common Stock"
ENTG,"Entegris, Inc. - Common Stock"
ENTO,Entero Therapeutics Inc. - Common Stock
ENTX,Entera Bio Ltd. - Ordinary Shares
ENV,"Envestnet, Inc Common Stock"
ENVA,"Enova International, Inc. Common Stock"
ENVB,"Enveric Biosciences, Inc.  - Common Stock"
ENVX,Enovix Corporation - Common Stock
ENX,"Eaton Vance New York Municipal Bond Fund Common Shares of Beneficial Interest, $.01 par value"
ENZ,"Enzo Biochem, Inc. Common Stock ($0.01 Par Value)"
ENZL,iShares MSCI New Zealand ETF
EOCT,Innovator Emerging Markets Power Buffer ETF - October
EOD,Allspring Global Dividend Opportunity Fund Common Shares of Beneficial Interest
EOG,"EOG Resources, Inc. Common Stock"
EOI,Eaton Vance Enhance Equity Income Fund Eaton Vance Enhanced Equity Income Fund Shares of Beneficial Interest
EOLS,"Evolus, Inc. - Common Stock"
EONR,EON Resources Inc. Class A Common Stock
EONR.W,"EON Resources Inc. Warrants, each whole warrant exercisable for three quarters of one share of Class A Common Stock at an exercise price of $11.50 per whole share"
EOS,Eaton Vance Enhance Equity Income Fund II Common Stock
EOSE,"Eos Energy Enterprises, Inc. - Common Stock"
EOSEW,"Eos Energy Enterprises, Inc. - Warrant"
EOT,Eaton Vance Municipal Income Trust EATON VANCE NATIONAL MUNICIPAL OPPORTUNITIES TRUST
EP,Empire Petroleum Corporation Common Stock
EP$C,El Paso Corporation Preferred Stock
EPAC,Enerpac Tool Group Corp. Common Stock
EPAM,"EPAM Systems, Inc. Common Stock"
EPC,Edgewell Personal Care Company Common Stock
EPD,Enterprise Products Partners L.P. Common Stock
EPHE,iShares MSCI Philippines ETF
EPI,WisdomTree India Earnings Fund
EPIX,ESSA Pharma Inc. - Common Stock
EPM,"Evolution Petroleum Corporation, Inc. Common Stock"
EPOL,iShares Trust iShares MSCI Poland ETF
EPOW,"Sunrise New Energy Co., Ltd - Class A Ordinary Shares"
EPP,iShares MSCI Pacific Ex-Japan Index Fund
EPR,EPR Properties Common Stock
EPR$C,EPR Properties 5.75% Series C Cumulative Convertible Preferred Shares
EPR$E,EPR Properties Series E Cumulative Conv Pfd Shs Ser E
EPR$G,EPR Properties 5.750% Series G Cumulative Redeemable Preferred Shares
EPRF,Innovator S&P Investment Grade Preferred ETF
EPRT,"Essential Properties Realty Trust, Inc. Common Stock"
EPRX,Eupraxia Pharmaceuticals Inc. - Common Stock
EPS,WisdomTree U.S. LargeCap Fund
EPSN,Epsilon Energy Ltd. - Common Shares
EPU,iShares MSCI Peru and Global Exposure ETF
EPV,ProShares UltraShort FTSE Europe ETF
EQ,"Equillium, Inc. - Common Stock"
EQAL,Invesco Russell 1000 Equal Weight ETF
EQBK,"Equity Bancshares, Inc. Class A Common Stock"
EQC,Equity Commonwealth Common Shares of Beneficial Interest
EQC$D,Equity Commonwealth 6.50% Pfd Conv Shs Ser D
EQH,"Equitable Holdings, Inc. Common Stock"
EQH$A,"Equitable Holdings, Inc. Depositary Shares"
EQH$C,"Equitable Holdings, Inc. Depositary Shares, each representing a 1/1,000th interest in a share of Fixed Rate Noncumulative Perpetual Preferred Stock, Series C"
EQIN,Columbia U.S. Equity Income ETF
EQIX,"Equinix, Inc. - Common Stock"
EQL,ALPS Equal Sector Weight ETF
EQLS,Simplify Exchange Traded Funds Simplify Market Neutral Equity Long/Short ETF
EQLT,iShares Trust iShares MSCI Emerging Markets Quality Factor ETF
EQNR,Equinor ASA
EQR,Equity Residential Common Shares of Beneficial Interest
EQRR,ProShares Equities for Rising Rates ETF
EQS,"Equus Total Return, Inc. Common Stock"
EQT,EQT Corporation Common Stock
EQTY,Valued Advisers Trust Kovitz Core Equity ETF
EQUL,NYLI Engender Equality ETF
EQV,EQV Ventures Acquisition Corp. Class A Ordinary Shares
EQV.U,"EQV Ventures Acquisition Corp. Units, each consisting of one Class A ordinary share and one-third of one redeemable warrant"
EQV.W,"EQV Ventures Acquisition Corp. Redeemable warrants, each whole warrant exercisable for one Class A ordinary share at an exercise price of $11.50 per share"
EQWL,Invesco S&P 100 Equal Weight ETF
EQX,Equinox Gold Corp. Common Shares
ERAS,"Erasca, Inc. - Common Stock"
ERC,Allspring Multi-Sector Income Fund Common Stock
ERET,iShares Environmentally Aware Real Estate ETF
ERH,Allspring Utilities and High Income Fund Common Shares
ERIC,Ericsson - American Depositary Shares each representing 1 underlying Class B share
ERIE,Erie Indemnity Company - Class A Common Stock
ERII,"Energy Recovery, Inc. - Common Stock"
ERJ,Embraer S.A. Common Stock
ERNA,Eterna Therapeutics Inc. - Common Stock
ERNZ,TrueShares Active Yield ETF
ERO,Ero Copper Corp. Common Shares
ERTH,Invesco MSCI Sustainable Future ETF
ERX,Direxion Energy Bull 2X Shares
ERY,Direxion Daily Energy Bear 2X Shares
ES,Eversource Energy (D/B/A) Common Stock
ESAB,ESAB Corporation Common Stock
ESBA,"Empire State Realty OP, L.P. Series ES Operating Partnership Units Representing Limited Partnership Interests"
ESCA,"Escalade, Incorporated - Common Stock"
ESE,ESCO Technologies Inc. Common Stock
ESEA,Euroseas Ltd. - Common Stock
ESG,FlexShares STOXX US ESG Select Index Fund
ESGA,American Century Sustainable Equity ETF
ESGB,NYLI MacKay ESG Core Plus Bond ETF
ESGD,iShares ESG Aware MSCI EAFE ETF
ESGE,iShares ESG Aware MSCI EM ETF
ESGG,FlexShares STOXX Global ESG Select Index Fund
ESGL,ESGL Holdings Limited - Class A Ordinary Shares
ESGLW,ESGL Holdings Limited - Warrants
ESGR,Enstar Group Limited - Ordinary Shares
ESGRO,"Enstar Group Limited - Depository Shares 7.00% Perpetual Non-Cumulative Preference Shares, Series E"
ESGRP,Enstar Group Limited - Depositary Shares Each Representing 1/1000th of an interest in Preference Shares
ESGU,iShares ESG Aware MSCI USA ETF
ESGV,Vanguard ESG U.S. Stock ETF
ESGX,ETF Opportunities Trust Tuttle Capital Shareholders First Index ETF
ESGY,American Century Sustainable Growth ETF
ESHA,ESH Acquisition Corp. - Class A Common Stock
ESHAR,ESH Acquisition Corp. - Right
ESI,Element Solutions Inc. Common Stock
ESIX,SSGA Active Trust SPDR S&P SmallCap 600 ESG ETF
ESLA,"Estrella Immunopharma, Inc. - Common Stock"
ESLAW,"Estrella Immunopharma, Inc. - Warrant"
ESLT,Elbit Systems Ltd. - Ordinary Shares
ESML,iShares ESG Aware MSCI USA Small-Cap ETF
ESMV,iShares ESG MSCI USA Min Vol Factor ETF
ESN,Essential 40 Stock ETF
ESNT,Essent Group Ltd. Common Shares
ESOA,Energy Services of America Corporation - Common Stock
ESP,Espey Mfg. & Electronics Corp. Common Stock
ESPO,VanEck Video Gaming and eSports ETF
ESPR,"Esperion Therapeutics, Inc. - Common Stock"
ESQ,"Esquire Financial Holdings, Inc. - Common Stock"
ESRT,"Empire State Realty Trust, Inc. Class A Common Stock"
ESS,"Essex Property Trust, Inc. Common Stock"
ESSA,"ESSA Bancorp, Inc. - common stock"
ESTA,Establishment Labs Holdings Inc. - Common Shares
ESTC,Elastic N.V. Ordinary Shares
ESUS,ETRACS 2x Leveraged MSCI US ESG Focus TR ETN
ET,Energy Transfer LP Common Units 
ET$I,Energy Transfer L.P. Series I Fixed Rate Perpetual Preferred Units
ETB,Eaton Vance Tax-Managed Buy-Write Income Fund Eaton Vance Tax-Managed Buy-Write Income Fund Common Shares of Beneficial Interest
ETD,Ethan Allen Interiors Inc. Common Stock
ETEC,iShares Breakthrough Environmental Solutions ETF
ETG,Eaton Vance Tax-Advantaged Global Dividend Income Fund Common Shares of Beneficial Interest
ETH,Grayscale Ethereum Mini Trust (ETH) Common units of fractional undivided beneficial interest
ETHA,iShares Ethereum Trust - iShares Ethereum Trust ETF
ETHD,ProShares Trust ProShares UltraShort Ether ETF
ETHE,Grayscale Ethereum Trust (ETH) Common units of fractional undivided beneficial interest
ETHO,Amplify ETF Trust Amplify Etho Climate Leadership U.S. ETF
ETHT,ProShares Trust ProShares Ultra Ether ETF
ETHU,Volatility Shares Trust 2x Ether ETF
ETHV,VanEck Ethereum ETF VanEck Ethereum ETF
ETHW,Bitwise Ethereum ETF Common shares of beneficial interest
ETI$,"Entergy Texas Inc 5.375% Series A Preferred Stock, Cumulative, No Par Value"
ETJ,Eaton Vance Risk-Managed Diversified Equity Income Fund Common Shares of Beneficial Interest
ETN,"Eaton Corporation, PLC Ordinary Shares"
ETNB,"89bio, Inc. - Common Stock"
ETO,Eaton Vance Tax-Advantage Global Dividend Opp Common Stock
ETON,"Eton Pharmaceuticals, Inc. - Common Stock"
ETQ,T-Rex 2X Long Bitcoin Daily Target ETF T-Rex 2X Inverse Ether Daily Target ETF
ETR,Entergy Corporation Common Stock
ETSY,"Etsy, Inc. - Common Stock"
ETU,T-Rex 2X Long Bitcoin Daily Target ETF T-Rex 2X Long Ether Daily Target ETF
ETV,Eaton Vance Corporation Eaton Vance Tax-Managed Buy-Write Opportunities Fund Common Shares of Beneficial Interest
ETW,Eaton Vance Corporation Eaton Vance Tax-Managed Global Buy-Write Opportunites Fund Common Shares of Beneficial Interest
ETWO,"E2open Parent Holdings, Inc.Class A Common Stock"
ETWO.W,"E2open Parent Holdings, Inc. Warrants"
ETX,Eaton Vance Municipal Income 2028 Term Trust Common Shares of Beneficial Interest
ETY,"Eaton Vance Tax-Managed Diversified Equity Income Fund Common Shares of Beneficial Interest,"
EU,enCore Energy Corp. - Common Stock
EUAD,Spinnaker ETF Series Select STOXX Europe Aerospace & Defense ETF
EUDA,Euda Health Holdings Limited - Ordinary Shares
EUDAW,Euda Health Holdings Limited - Warrant
EUDG,WisdomTree Europe Quality Dividend Growth Fund
EUDV,ProShares MSCI Europe Dividend Growers ETF
EUFN,iShares MSCI Europe Financials ETF
EUM,ProShares Short MSCI Emerging Markets
EUO,ProShares UltraShort Euro
EURK,Eureka Acquisition Corp - Class A Ordinary Share
EURKR,Eureka Acquisition Corp - Right
EURKU,Eureka Acquisition Corp - Unit
EURL,Direxion Daily FTSE Europe Bull 3x Shares
EUSA,iShares MSCI USA Equal Weighted ETF
EUSB,iShares ESG Advanced Total USD Bond Market ETF
EUSC,WisdomTree Europe Hedged SmallCap Equity Fund
EV,NEOS ETF Trust Mast Global Battery Recycling & Production ETF
EVAV,Direxion Shares ETF Trust Direxion Daily Electric and Autonomous Vehicles Bull 2X Shares
EVAX,Evaxion Biotech A/S - American Depositary Share
EVBN,"Evans Bancorp, Inc. Common Stock"
EVC,Entravision Communications Corporation Common Stock
EVCM,EverCommerce Inc. - Common Stock
EVE,EVe Mobility Acquisition Corp Class A Ordinary Shares
EVE.U,"EVe Mobility Acquisition Corp Units, each consisting of one Class A ordinary share and one-half of one redeemable warrant("
EVE.W,"EVe Mobility Acquisition Corp Redeemable warrants, each whole warrant exercisable for one Class A ordinary share at an exercise price of $11.50"
EVER,"EverQuote, Inc. - Class A Common Stock"
EVEX,"Eve Holding, Inc. Common Stock"
EVEX.W,"Eve Holding, Inc. Warrants, each exercisable for one share of Common Stock at an exercise price of $11.50 per share"
EVF,Eaton Vance Senior Income Trust Common Stock
EVG,Eaton Vance Short Diversified Income Fund Eaton Vance Short Duration Diversified Income Fund Common Shares of Beneficial Interest
EVGN,Evogene Ltd. - Ordinary Shares
EVGO,EVgo Inc. - Common Stock
EVGOW,"EVgo Inc. - Warrants, each whole warrant exercisable for one share of Class A Common Stock at an exercise price of $11.50"
EVGR,Evergreen Corporation - Class A Ordinary Share
EVGRU,Evergreen Corporation - Unit
EVGRW,Evergreen Corporation - Warrant
EVH,"Evolent Health, Inc Class A Common Stock"
EVHY,Morgan Stanley ETF Trust Eaton Vance High Yield ETF
EVI,"EVI Industries, Inc.  Common Stock"
EVIM,Morgan Stanley ETF Trust Eaton Vance Intermediate Municipal Income ETF
EVLN,Morgan Stanley ETF Trust Eaton Vance Floating-Rate ETF
EVLU,iShares Trust iShares MSCI Emerging Markets Value Factor ETF
EVLV,"Evolv Technologies Holdings, Inc. - Class A Common Stock"
EVLVW,"Evolv Technologies Holdings, Inc. - Warrant"
EVM,"Eaton Vance California Municipal Bond Fund Common Shares of Beneficial Interest, $.01 par value"
EVMT,Invesco Electric Vehicle Metals Commodity Strategy No K-1 ETF
EVN,Eaton Vance Municipal Income Trust Common Stock
EVNT,AltShares Event-Driven ETF
EVO,Evotec SE - American Depositary Shares each representing 1/2 of one ordinary share
EVOK,"Evoke Pharma, Inc. - Common Stock"
EVR,Evercore Inc. Class A Common Stock
EVRG,"Evergy, Inc. - Common Stock"
EVRI,Everi Holdings Inc. Common Stock
EVSB,Morgan Stanley ETF Trust Eaton Vance Ultra-Short Income ETF
EVSD,Eaton Vance Short Duration Income ETF
EVSM,Morgan Stanley ETF Trust Eaton Vance Short Duration Municipal Income ETF
EVT,Eaton Vance Tax Advantaged Dividend Income Fund Common Shares of Beneficial Interest
EVTC,"Evertec, Inc. Common Stock"
EVTL,Vertical Aerospace Ltd. Ordinary Shares
EVTL.W,"Vertical Aerospace Ltd. Warrants, each whole warrant exercisable for one ordinary share at an exercise price of $11.50 per share"
EVTR,Morgan Stanley ETF Trust Eaton Vance Total Return Bond ETF
EVTV,"Envirotech Vehicles, Inc. - Common stock"
EVUS,iShares Trust iShares ESG Aware MSCI USA Value ETF
EVV,Eaton Vance Limited Duration Income Fund Common Shares of Beneficial Interest
EVX,VanEck Environmental Services ETF
EW,Edwards Lifesciences Corporation Common Stock
EWA,iShares MSCI Australia Index Fund
EWBC,"East West Bancorp, Inc. - Common Stock"
EWC,iShares MSCI Canada Index Fund
EWCZ,"European Wax Center, Inc. - Class A Common Stock"
EWD,iShares Inc iShares MSCI Sweden ETF
EWG,iShares MSCI Germany Index Fund
EWH,iShares MSCI Hong Kong Index Fund
EWI,iShares Inc iShares MSCI Italy ETF
EWJ,iShares MSCI Japan Index Fund
EWJV,iShares MSCI Japan Value ETF
EWK,iShares Inc iShares MSCI Belgium ETF
EWL,iShares Inc iShares MSCI Switzerland ETF
EWM,iShares MSCI Malaysia Index Fund
EWN,iShares MSCI Netherlands Index Fund
EWO,iShares Inc iShares MSCI Austria ETF
EWP,iShares Inc iShares MSCI Spain ETF
EWQ,iShares MSCI France Index Fund
EWS,iShares Inc iShares MSCI Singapore ETF
EWT,iShares Inc iShares MSCI Taiwan ETF
EWTX,"Edgewise Therapeutics, Inc. - Common Stock"
EWU,iShares MSCI United Kingdom ETF
EWUS,iShares MSCI United Kingdom Small Cap ETF
EWV,ProShares UltraShort MSCI Japan
EWW,iShares Inc iShares MSCI Mexico ETF
EWX,SPDR S&P Emerging Markets Small Cap ETF
EWY,iShares Inc iShares MSCI South Korea ETF
EWZ,iShares Inc iShares MSCI Brazil ETF
EWZS,iShares MSCI Brazil Small-Cap ETF
EXAI,Exscientia Plc - American Depositary Shares
EXAS,Exact Sciences Corporation - Common Stock
EXC,Exelon Corporation - Common Stock
EXE,Expand Energy Corporation - Common Stock
EXEEL,Expand Energy Corporation - Class C Warrants
EXEEW,Expand Energy Corporation - Class A Warrants
EXEEZ,Expand Energy Corporation - Class B Warrants
EXEL,"Exelixis, Inc. - Common Stock"
EXFY,"Expensify, Inc. - Class A Common Stock"
EXG,Eaton Vance Tax-Managed Global Diversified Equity Income Fund Common Shares of Beneficial Interest
EXI,iShares Global Industrials ETF
EXK,Endeavour Silver Corporation Ordinary Shares (Canada)
EXLS,"ExlService Holdings, Inc. - Common Stock"
EXP,Eagle Materials Inc Common Stock
EXPD,"Expeditors International of Washington, Inc. Common Stock"
EXPE,"Expedia Group, Inc. - Common Stock"
EXPI,"eXp World Holdings, Inc. - Common Stock"
EXPO,"Exponent, Inc. - Common Stock"
EXR,Extra Space Storage Inc Common Stock
EXTO,"Almacenes Exito S.A. American Depositary Share, each representing eight (8) Common Shares"
EXTR,"Extreme Networks, Inc. - Common Stock"
EYE,"National Vision Holdings, Inc. - Common Stock"
EYEG,AB Corporate Bond ETF
EYEN,"Eyenovia, Inc. - Common Stock"
EYLD,Cambria ETF Trust Cambria Emerging Shareholder Yield ETF
EYPT,"EyePoint Pharmaceuticals, Inc. - Common Stock"
EZA,iShares MSCI South Africa Index Fund
EZBC,Franklin Templeton Digital Holdings Trust Shares of Franklin Bitcoin ETF
EZET,Franklin Ethereum ETF Franklin Ethereum ETF
