Symbol,Security Name
A,"Agilent Technologies, Inc. Common Stock"
AA,Alcoa Corporation Common Stock 
AAA,Alternative Access First Priority CLO Bond ETF
AAAU,Goldman Sachs Physical Gold ETF Shares
AACG,"ATA Creativity Global - American Depositary Shares, each representing two common shares"
AACT,Ares Acquisition Corporation II Class A Ordinary Shares
AACT.U,"Ares Acquisition Corporation II Units, each consisting of one Class A ordinary share and one-half of one redeemable warrant"
AACT.W,"Ares Acquisition Corporation II Redeemable Warrants, each whole warrant exercisable for one Class A ordinary share at an exercise price of $11.50"
AADI,"Aadi Bioscience, Inc. - Common Stock"
AADR,AdvisorShares Dorsey Wright ADR ETF
AAL,"American Airlines Group, Inc. - Common Stock"
AAM,AA Mission Acquisition Corp. Class A Ordinary Shares
AAM.U,"AA Mission Acquisition Corp. Units, each consisting of one Class A Ordinary Share and one-half of one redeemable warrant"
AAM.W,"AA Mission Acquisition Corp. Warrants, each whole warrant entitles the holder to purchase one Class A ordinary share at a price of $11.50 per share"
AAME,Atlantic American Corporation - Common Stock
AAOI,"Applied Optoelectronics, Inc. - Common Stock"
AAON,"AAON, Inc. - Common Stock"
AAP,Advance Auto Parts Inc.
AAPB,GraniteShares 2x Long AAPL Daily ETF
AAPD,Direxion Daily AAPL Bear 1X Shares
AAPL,Apple Inc. - Common Stock
AAPR,SHL Telemedicine Ltd Innovator Equity Defined Protection ETF - 2 Yr to April 2026
AAPU,Direxion Daily AAPL Bull 2X Shares
AAPX,ETF Opportunities Trust T-Rex 2X Long Apple Daily Target ETF
AAPY,NEOS ETF Trust Kurv Yield Premium Strategy Apple (AAPL) ETF
AAT,"American Assets Trust, Inc. Common Stock"
AAXJ,iShares MSCI All Country Asia ex Japan ETF
AB,AllianceBernstein Holding L.P.  Units
ABAT,American Battery Technology Company - Common Stock
ABBV,AbbVie Inc. Common Stock
ABCB,Ameris Bancorp Common Stock
ABCL,AbCellera Biologics Inc. - Common Shares
ABCS,Alpha Blue Capital US Small-Mid Cap Dynamic ETF
ABEO,Abeona Therapeutics Inc. - Common Stock
ABEQ,Absolute Select Value ETF
ABEV,Ambev S.A. American Depositary Shares (Each representing 1 Common Share)
ABG,Asbury Automotive Group Inc Common Stock
ABL,"Abacus Life, Inc. - Class A Common Stock"
ABLLL,"Abacus Life, Inc. - 9.875% Fixed Rate Senior Notes due 2028"
ABLLW,"Abacus Life, Inc. - Warrant"
ABLV,Able View Global Inc. - Class B Ordinary Shares
ABLVW,Able View Global Inc. - Warrant
ABM,ABM Industries Incorporated Common Stock
ABNB,"Airbnb, Inc. - Class A Common Stock"
ABNY,Tidal Trust II YieldMax ABNB Option Income Strategy ETF
ABOS,"Acumen Pharmaceuticals, Inc. - Common Stock"
ABP,"Abpro Holdings, Inc - Common Stock"
ABPWW,"Abpro Holdings, Inc - Warrant"
ABR,Arbor Realty Trust Common Stock
ABR$D,"Arbor Realty Trust 6.375% Series D Cumulative Redeemable Preferred Stock, Liquidation Preference $25.00 per Share"
ABR$E,Arbor Realty Trust 6.25% Series E Cumulative Redeemable Preferred Stock
ABR$F,"Arbor Realty Trust 6.25% Series F Fixed-to-Floating Rate Cumulative Redeemable Preferred Stock, Liquidation Preference $25.00 per share"
ABSI,Absci Corporation - Common Stock
ABT,Abbott Laboratories Common Stock
ABTS,Abits Group Inc - Ordinary Shares
ABUS,Arbutus Biopharma Corporation - Common Stock
ABVC,"ABVC BioPharma, Inc. - Common Stock"
ABVE,Above Food Ingredients Inc. - Common Stock
ABVEW,Above Food Ingredients Inc. - Warrant
ABVX,Abivax SA - American Depositary Shares
AC,"Associated Capital Group, Inc. Common Stock"
ACA,"Arcosa, Inc. Common Stock "
ACAD,ACADIA Pharmaceuticals Inc. - Common Stock
ACB,Aurora Cannabis Inc. - Common Shares
ACCD,"Accolade, Inc. - common stock"
ACCO,Acco Brands Corporation Common Stock
ACDC,ProFrac Holding Corp. - Class A Common Stock
ACEL,"Accel Entertainment, Inc. "
ACES,ALPS Clean Energy ETF
ACET,"Adicet Bio, Inc. - Common Stock"
ACGL,Arch Capital Group Ltd. - Common Stock
ACGLN,"Arch Capital Group Ltd. - Depositary Shares, each Representing a 1/1,000th Interest in a 4.550% Non-Cumulative Preferred Share, Series G"
ACGLO,"Arch Capital Group Ltd. - Depositary Shares Each Representing 1/1,000th Interest in a Share of5.45% Non-Cumulative Preferred Shares, Series F"
ACHC,"Acadia Healthcare Company, Inc. - Common Stock"
ACHL,Achilles Therapeutics plc - American Depositary Shares
ACHR,Archer Aviation Inc. Class A Common Stock
ACHR.W,"Archer Aviation Inc. Redeemable Warrants, each whole warrant exercisable for one Class A common stock at an exercise price of $11.50"
ACHV,"Achieve Life Sciences, Inc.  - Common Shares"
ACI,"Albertsons Companies, Inc. Class A Common Stock"
ACIC,American Coastal Insurance Corporation - Common Stock
ACIO,Aptus Collared Investment Opportunity ETF
ACIU,AC Immune SA - Common Stock
ACIW,"ACI Worldwide, Inc. - Common Stock"
ACLS,"Axcelis Technologies, Inc. - Common Stock"
ACLX,"Arcellx, Inc. - Common Stock"
ACM,AECOM Common Stock
ACMR,"ACM Research, Inc. - Class A Common Stock"
ACN,Accenture plc Class A Ordinary Shares (Ireland)
ACNB,ACNB Corporation - Common Stock
ACNT,Ascent Industries Co. - Common Stock
ACOG,Alpha Cognition Inc. - Common Stock
ACON,"Aclarion, Inc. - Common Stock"
ACONW,"Aclarion, Inc. - Warrant"
ACP,abrdn Income Credit Strategies Fund Common Shares
ACP$A,abrdn Income Credit Strategies Fund 5.250% Series A Perpetual Preferred Stock
ACR,ACRES Commercial Realty Corp. Common Stock
ACR$C,ACRES Commercial Realty Corp. 8.625% Fixed-to-Floating Series C Cumulative Redeemable Preferred Stock 
ACR$D,ACRES Commercial Realty Corp. 7.875% Series D Cumulative Redeemable Preferred Stock
ACRE,Ares Commercial Real Estate Corporation Common Stock
ACRS,"Aclaris Therapeutics, Inc. - Common Stock"
ACRV,"Acrivon Therapeutics, Inc. - Common Stock"
ACSI,American Customer Satisfaction ETF
ACT,"Enact Holdings, Inc. - Common Stock"
ACTG,Acacia Research Corporation - Common Stock
ACTU,"Actuate Therapeutics, Inc. - Common stock"
ACTV,LeaderShares Activist Leaders ETF
ACU,Acme United Corporation. Common Stock
ACV,Virtus Diversified Income & Convertible Fund Common Shares of Beneficial Interest
ACVA,ACV Auctions Inc. - Class A Common Stock
ACVF,American Conservative Values ETF
ACWI,iShares MSCI ACWI ETF
ACWV,iShares MSCI Global Min Vol Factor ETF
ACWX,iShares MSCI ACWI ex U.S. ETF
ACXP,"Acurx Pharmaceuticals, Inc. - Common Stock"
ADAG,"Adagene Inc. - ADS, each representing 1.25 ordinary shares"
ADAP,Adaptimmune Therapeutics plc - American Depositary Shares
ADBE,Adobe Inc. - Common Stock
ADC,Agree Realty Corporation Common Stock
ADC$A,"Agree Realty Corporation Depositary Shares, each representing 1/1,000th of a 4.250% Series A Cumulative Redeemable Preferred Stock"
ADCT,ADC Therapeutics SA Common Shares
ADD,"Color Star Technology Co., Ltd. - Class A Ordinary Shares"
ADEA,Adeia Inc.  - Common Stock
ADFI,Anfield Dynamic Fixed Income ETF
ADGM,"Adagio Medical Holdings, Inc - Common Stock"
ADI,"Analog Devices, Inc. - Common Stock"
ADIL,"Adial Pharmaceuticals, Inc - Common Stock"
ADIV,SmartETFs Asia Pacific Dividend Builder ETF
ADM,Archer-Daniels-Midland Company Common Stock
ADMA,ADMA Biologics Inc - Common Stock
ADME,Aptus Drawdown Managed Equity ETF
ADN,"Advent Technologies Holdings, Inc. - Class A Common Stock"
ADNT,Adient plc Ordinary Shares 
ADNWW,"Advent Technologies Holdings, Inc. - Warrant"
ADP,"Automatic Data Processing, Inc. - Common Stock"
ADPT,Adaptive Biotechnologies Corporation - Common Stock
ADPV,Series Portfolios Trust Adaptiv Select ETF
ADSE,ADS-TEC ENERGY PLC - Ordinary Shares
ADSEW,ADS-TEC ENERGY PLC - Warrant
ADSK,"Autodesk, Inc. - Common Stock"
ADT,ADT Inc. Common Stock
ADTN,"ADTRAN Holdings, Inc. - Common Stock"
ADTX,"Aditxt, Inc. - Common Stock"
ADUR,Aduro Clean Technologies Inc. - Common Stock
ADUS,Addus HomeCare Corporation - Common Stock
ADV,Advantage Solutions Inc.  - Class A Common Stock
ADVE,Matthews International Funds Matthews Asia Dividend Active ETF
ADVM,"Adverum Biotechnologies, Inc. - Common Stock"
ADVWW,Advantage Solutions Inc.  - Warrant
ADX,Adams Diversified Equity Fund Inc.
ADXN,Addex Therapeutics Ltd - American Depositary Shares
AE,"Adams Resources & Energy, Inc. Common Stock"
AEE,Ameren Corporation Common Stock
AEF,"abrdn Emerging Markets Equity Income Fund, Inc. Common Stock"
AEFC,Aegon Funding Company LLC 5.10% Subordinated Notes due 2049
AEG,Aegon Ltd. New York Registry Shares
AEHL,Antelope Enterprise Holdings Limited - Class A Ordinary Shares
AEHR,Aehr Test Systems - Common Stock
AEI,Alset Inc. - Common Stock
AEIS,"Advanced Energy Industries, Inc. - Common Stock"
AEM,Agnico Eagle Mines Limited Common Stock
AEMD,"Aethlon Medical, Inc. - Common Stock"
AENT,Alliance Entertainment Holding Corporation - common stock
AENTW,Alliance Entertainment Holding Corporation - Warrants
AEO,"American Eagle Outfitters, Inc. Common Stock"
AEON,"AEON Biopharma, Inc. Class A Common Stock"
AEP,"American Electric Power Company, Inc. - Common Stock"
AER,AerCap Holdings N.V. Ordinary Shares
AERT,"Aeries Technology, Inc. - Class A Ordinary Share"
AERTW,"Aeries Technology, Inc. - Warrant"
AES,The AES Corporation Common Stock
AESI,Atlas Energy Solutions Inc. Common Stock
AESR,Anfield U.S. Equity Sector Rotation ETF
AETH,Bitwise Funds Trust Bitwise Ethereum Strategy ETF
AEVA,"Aeva Technologies, Inc. Common Stock"
AEVA.W,"Aeva Technologies, Inc. Redeemable Warrants, each whole warrant exercisable for shares of common stock at an exercise price of $11.50 per share"
AEYE,"AudioEye, Inc. - Common Stock"
AFB,AllianceBernstein National Municipal Income Fund Inc
AFBI,"Affinity Bancshares, Inc. - Common Stock"
AFCG,Advanced Flower Capital Inc. - Common Stock
AFG,"American Financial Group, Inc. Common Stock"
AFGB,"American Financial Group, Inc. 5.875% Subordinated Debentures due 2059"
AFGC,"American Financial Group, Inc. 5.125% Subordinated Debentures due 2059"
AFGD,"American Financial Group, Inc. 5.625% Subordinated Debentures due 2060"
AFGE,"American Financial Group, Inc. 4.500% Subordinated Debentures due 2060"
AFIF,Anfield Universal Fixed Income ETF
AFJK,"Aimei Health Technology Co., Ltd - Ordinary Share"
AFJKR,"Aimei Health Technology Co., Ltd - Right"
AFJKU,"Aimei Health Technology Co., Ltd - Unit"
AFK,VanEck Africa Index ETF
AFL,AFLAC Incorporated Common Stock
AFLG,First Trust Active Factor Large Cap ETF
AFMC,First Trust Active Factor Mid Cap ETF
AFMD,Affimed N.V. - Common Stock
AFRI,Forafric Global PLC - Ordinary Shares
AFRIW,Forafric Global PLC - Warrants
AFRM,"Affirm Holdings, Inc. - Class A Common Stock"
AFSM,First Trust Active Factor Small Cap ETF
AFYA,Afya Limited - Class A Common Shares
AG,First Majestic Silver Corp. Ordinary Shares (Canada)
AGAE,Allied Gaming & Entertainment Inc. - Common Stock
AGCO,AGCO Corporation Common Stock
AGD,abrdn Global Dynamic Dividend Fund Common Shares of Beneficial Interest
AGEN,Agenus Inc. - Common Stock
AGFY,Agrify Corporation - Common Stock
AGG,iShares Core U.S. Aggregate Bond ETF
AGGH,Simplify Aggregate Bond ETF
AGGS,Harbor ETF Trust Harbor Disciplined Bond ETF
AGGY,WisdomTree Yield Enhanced U.S. Aggregate Bond Fund
AGI,Alamos Gold Inc. Class A Common Shares
AGIH,iShares U.S. ETF Trust iShares Inflation Hedged U.S. Aggregate Bond ETF
AGIO,"Agios Pharmaceuticals, Inc. - Common Stock"
AGIX,KraneShares Artificial Intelligence & Technology ETF
AGL,"agilon health, inc. Common Stock"
AGM,Federal Agricultural Mortgage Corporation Common Stock
AGM$D,"Federal Agricultural Mortgage Corporation 5.700% Non-Cumulative Preferred Stock, Series D"
AGM$E,"Federal Agricultural Mortgage Corporation 5.750% Non-Cumulative Preferred Stock, Series E"
AGM$F,"Federal Agricultural Mortgage Corporation 5.250% Non-Cumulative Preferred Stock, Series F"
AGM$G,"Federal Agricultural Mortgage Corporation 4.875% Non-Cumulative Preferred Stock, Series G"
AGM.A,Federal Agricultural Mortgage Corporation Common Stock
AGMH,AGM Group Holdings Inc. - Class A Ordinary Shares
AGMI,Themes Silver Miners ETF
AGNC,AGNC Investment Corp. - Common Stock
AGNCL,"AGNC Investment Corp. - Depositary Shares Each Representing a 1/1,000th Interest in a Share of 7.75% Series G Fixed-Rate Reset Cumulative Redeemable Preferred Stock"
AGNCM,AGNC Investment Corp. - Depositary Shares rep 6.875% Series D Fixed-to-Floating Cumulative Redeemable Preferred Stock
AGNCN,"AGNC Investment Corp. - Depositary Shares Each Representing a 1/1,000th Interest in a Share of 7.00% Series C Fixed-To-Floating Rate Cumulative Redeemable Preferred Stock"
AGNCO,"AGNC Investment Corp. - Depositary Shares, each representing a 1/1,000th interest in a share of Series E Fixed-to-Floating Cumulative Redeemable Preferred Stock"
AGNCP,"AGNC Investment Corp. - Depositary Shares Each Representing a 1/1,000th Interest in a Share of 6.125% Series F Fixed-to-Floating Rate Cumulative Redeemable Preferred Stock"
AGNG,Global X Aging Population ETF
AGO,Assured Guaranty Ltd. Common Stock
AGOX,Adaptive Alpha Opportunities ETF
AGQ,ProShares Ultra Silver
AGQI,First Trust Exchange-Traded Fund VIII First Trust Active Global Quality Income ETF
AGR,"Avangrid, Inc. Common Stock"
AGRH,iShares U.S. ETF Trust iShares Interest Rate Hedged U.S. Aggregate Bond ETF
AGRI,AgriFORCE  Growing Systems Ltd. - Common Shares
AGRO,Adecoagro S.A. Common Shares
AGS,"PlayAGS, Inc. Common Stock"
AGX,"Argan, Inc. Common Stock"
AGYS,"Agilysys, Inc. - Common Stock"
AGZ,iShares  Agency Bond ETF
AGZD,WisdomTree Interest Rate Hedged U.S. Aggregate Bond Fund
AHCO,AdaptHealth Corp.  - Common Stock
AHG,Akso Health Group - American Depositary Shares
AHH,"Armada Hoffler Properties, Inc. Common Stock"
AHH$A,"Armada Hoffler Properties, Inc. 6.75% Series A Cumulative Redeemable Perpetual Preferred Stock"
AHL$C,Aspen Insurance Holdings Limited 5.95% Fixed-to-Floating Rate Perpetual Non-Cumulative Preference Shares
AHL$D,Aspen Insurance Holdings Limited 5.625% Perpetual Non-Cumulative Preference Shares
AHL$E,"Aspen Insurance Holdings Limited Depositary Shares, each representing a 1/1000th interest in a share of 5.625% Perpetual Non-Cumulative Preference Shares"
AHLT,American Beacon Select Funds American Beacon AHL Trend ETF
AHOY,Tidal ETF Trust Newday Ocean Health ETF
AHR,"American Healthcare REIT, Inc. Common Stock"
AHT,Ashford Hospitality Trust Inc Common Stock
AHT$D,Ashford Hospitality Trust Inc 8.45% Series D Cumulative Preferred Stock
AHT$F,Ashford Hospitality Trust Inc 7.375% Series F Cumulative Preferred Stock
AHT$G,Ashford Hospitality Trust Inc 7.375% Series G Cumulative Preferred Stock
AHT$H,Ashford Hospitality Trust Inc 7.50% Series H Cumulative Preferred Stock
AHT$I,Ashford Hospitality Trust Inc 7.50% Series I Cumulative Preferred Stock
AHYB,American Century Select High Yield ETF
AI,"C3.ai, Inc. Class A Common Stock"
AIA,iShares Asia 50 ETF
AIBD,Direxion Shares ETF Trust Direxion Daily AI and Big Data Bear 2X Shares
AIBU,Direxion Shares ETF Trust Direxion Daily AI and Big Data Bull 2X Shares
AIEQ,Amplify ETF Trust Amplify AI Powered Equity ETF
AIEV,"Thunder Power Holdings, Inc. - Common Stock"
AIFD,Engine No. 1 ETF Trust TCW Artificial Intelligence ETF
AIFF,"Firefly Neuroscience, Inc.  - Common Stock"
AIFU,AIX Inc. - American Depositary Shares
AIG,"American International Group, Inc. New Common Stock"
AIHS,Senmiao Technology Limited - Common Stock
AILE,"iLearningEngines, Inc. - Common Stock"
AILEW,"iLearningEngines, Inc. - Warrant"
AIM,AIM ImmunoTech Inc. Common Stock
AIMAU,Aimfinity Investment Corp. I - Unit
AIMAW,Aimfinity Investment Corp. I - Warrant
AIMBU,Aimfinity Investment Corp. I - Subunit
AIMD,"Ainos, Inc. - Common Stock"
AIMDW,"Ainos, Inc. - warrants"
AIN,Albany International Corporation Common Stock
AIO,Virtus Artificial Intelligence & Technology Opportunities Fund Common Shares of Beneficial Interest
AIOT,"PowerFleet, Inc. - Common Stock"
AIP,"Arteris, Inc.  - Common Stock"
AIPI,REX AI Equity Premium Income ETF
AIQ,Global X Artificial Intelligence & Technology ETF
AIR,AAR Corp. Common Stock
AIRE,reAlpha Tech Corp. - Common Stock
AIRG,"Airgain, Inc. - Common Stock"
AIRI,Air Industries Group Common Stock
AIRJ,AirJoule Technologies Corporation - Class A Common Stock
AIRJW,AirJoule Technologies Corporation - Warrant
AIRL,Themes Airlines ETF
AIRR,First Trust RBA American Industrial Renaissance ETF
AIRS,"AirSculpt Technologies, Inc. - Common Stock"
AIRT,"Air T, Inc. - Common Stock"
AIRTP,"Air T, Inc. - Trust Preferred Securities"
AISP,"Airship AI Holdings, Inc - Class A Common Stock"
AISPW,"Airship AI Holdings, Inc - Warrants"
AIT,"Applied Industrial Technologies, Inc. Common Stock"
AITR,AI TRANSPORTATION ACQUISITION CORP - Ordinary shares
AITRR,AI TRANSPORTATION ACQUISITION CORP - Right
AITRU,AI TRANSPORTATION ACQUISITION CORP - Unit
AIV,Apartment Investment and Management Company Common Stock
AIVC,Amplify Bloomberg AI Value Chain ETF
AIVI,WisdomTree International AI Enhanced Value Fund
AIVL,WisdomTree U.S. AI Enhanced Value Fund
AIXI,XIAO-I Corporation - American Depositary Shares
AIYY,Tidal Trust II YieldMax AI Option Income Strategy ETF
AIZ,"Assurant, Inc. Common Stock"
AIZN,"Assurant, Inc. 5.25% Subordinated Notes due 2061"
AJAN,Innovator ETFs Trust Innovator Equity Defined Protection ETF - 2 Yr to January 2026
AJG,Arthur J. Gallagher & Co. Common Stock
AJUL,SHL Telemedicine Ltd Innovator Equity Defined Protection ETF - 2 Yr to July 2026
AJX,Great Ajax Corp. Common Stock
AKA,a.k.a. Brands Holding Corp. Common Stock
AKAM,"Akamai Technologies, Inc. - Common Stock"
AKAN,Akanda Corp. - Common Shares
AKBA,"Akebia Therapeutics, Inc. - Common Stock"
AKO.A,Embotelladora Andina S.A. Common Stock
AKO.B,Embotelladora Andina S.A. Common Stock
AKR,Acadia Realty Trust Common Stock
AKRO,"Akero Therapeutics, Inc. - Common Stock"
AKTS,"Akoustis Technologies, Inc. - Common Stock"
AKTX,Akari Therapeutics Plc - American Depositary Shares
AKYA,"Akoya BioSciences, Inc. - Common Stock"
AL,Air Lease Corporation Class A Common Stock
ALAB,"Astera Labs, Inc. - Common Stock"
ALAI,The Alger ETF Trust Alger AI Enablers & Adopters ETF
ALAR,Alarum Technologies Ltd. - American Depositary Shares
ALB,Albemarle Corporation Common Stock
ALB$A,Albemarle Corporation Depositary Shares each representing a 1/20th of 7.25% Series A Mandatory Convertible Preferred Stock
ALBT,Avalon GloboCare Corp. - Common Stock
ALC,Alcon Inc. Ordinary Shares
ALCE,"Alternus Clean Energy, Inc. - Class A Common Stock"
ALCO,"Alico, Inc. - Common Stock"
ALCY,Alchemy Investments Acquisition Corp 1 - Class A Ordinary Shares
ALCYU,Alchemy Investments Acquisition Corp 1 - Units
ALCYW,Alchemy Investments Acquisition Corp 1 - Warrants
ALDFU,Aldel Financial II Inc. - Units
ALDX,"Aldeyra Therapeutics, Inc. - Common Stock"
ALE,"Allete, Inc."
ALEC,"Alector, Inc. - Common Stock"
ALEX,"Alexander & Baldwin, Inc. Common Stock REIT Holding Company"
ALF,Centurion Acquisition Corp. - Class A Ordinary Shares
ALFUU,Centurion Acquisition Corp. - Unit
ALFUW,Centurion Acquisition Corp. - Warrant
ALG,"Alamo Group, Inc. Common Stock"
ALGM,"Allegro MicroSystems, Inc. - Common Stock"
ALGN,"Align Technology, Inc. - Common Stock"
ALGS,"Aligos Therapeutics, Inc. - Common stock"
ALGT,Allegiant Travel Company - Common Stock
ALHC,"Alignment Healthcare, Inc. - Common Stock"
ALIT,"Alight, Inc. Class A Common Stock"
ALK,"Alaska Air Group, Inc. Common Stock"
ALKS,Alkermes plc - Ordinary Shares
ALKT,"Alkami Technology, Inc. - Common Stock"
ALL,Allstate Corporation (The) Common Stock
ALL$B,Allstate Corporation (The) 5.100% Fixed-to-Floating Rate Subordinated Debentures due 2053
ALL$H,"Allstate Corporation (The) Depositary Shares each representing a 1/1,000th interest in a share of Fixed Rate Noncumulative Perpetual Preferred Stock, Series H"
ALL$I,"Allstate Corporation (The) Depositary Shares each representing a 1/1,000th interest in a share of Fixed Rate Noncumulative Perpetual Preferred Stock, Series I"
ALL$J,"Allstate Corporation (The) Depositary Shares each representing a 1/1,000th interest in a share of Fixed Rate Noncumulative Perpetual Preferred Stock, Series J"
ALLE,Allegion plc Ordinary Shares
ALLK,Allakos Inc. - Common Stock
ALLO,"Allogene Therapeutics, Inc. - Common Stock"
ALLR,"Allarity Therapeutics, Inc. - Common stock"
ALLT,Allot Ltd. - Ordinary Shares
ALLY,Ally Financial Inc. Common Stock
ALMS,Alumis Inc. - Common Stock
ALNT,Allient Inc. - Common Stock
ALNY,"Alnylam Pharmaceuticals, Inc. - Common Stock"
ALOT,"AstroNova, Inc. - Common Stock"
ALRM,"Alarm.com Holdings, Inc. - Common Stock"
ALRN,"Aileron Therapeutics, Inc. - Common Stock"
ALRS,Alerus Financial Corporation - Common Stock
ALSA,Alpha Star Acquisition Corporation - Ordinary Shares
ALSAR,Alpha Star Acquisition Corporation - Rights
ALSAU,Alpha Star Acquisition Corporation - Units
ALSAW,Alpha Star Acquisition Corporation - Warrants
ALSN,"Allison Transmission Holdings, Inc. Common Stock"
ALT,"Altimmune, Inc. - Common Stock"
ALTG,Alta Equipment Group Inc. Class A Common Stock
ALTG$A,Alta Equipment Group Inc. Depositary Shares (each representing 1/1000th in a share of 10% Series A Cumulative Perpetual Preferred Stock)
ALTI,"AlTi Global, Inc. - Class A Common Stock"
ALTL,Pacer Lunt Large Cap Alternator ETF
ALTM,Arcadium Lithium plc Ordinary Shares
ALTO,"Alto Ingredients, Inc. - Common Stock"
ALTR,Altair Engineering Inc. - Class A Common Stock
ALTS,ALT5 Sigma Corporation - Common Stock
ALTY,Global X Alternative Income ETF
ALUR,"Allurion Technologies, Inc. Common Stock"
ALUR.W,"Allurion Technologies, Inc. Warrants, each whole warrant exercisable to purchase 1.420455 shares of common stock at an exercise price of $8.10 per share of common stock"
ALV,"Autoliv, Inc. Common Stock"
ALVO,Alvotech - Ordinary Shares
ALVOW,Alvotech - Warrant
ALVR,"AlloVir, Inc. - Common Stock"
ALX,"Alexander's, Inc. Common Stock"
ALXO,ALX Oncology Holdings Inc. - Common Stock
ALZN,"Alzamend Neuro, Inc. - Common Stock"
AM,Antero Midstream Corporation Common Stock
AMAL,Amalgamated Financial Corp. - Common Stock
AMAT,"Applied Materials, Inc. - Common Stock"
AMAX,Adaptive Hedged Multi-Asset Income ETF
AMBA,"Ambarella, Inc. - Ordinary Shares"
AMBC,"Ambac Financial Group, Inc. Common Stock"
AMBI,Ambipar Emergency Response Class A Ordinary Shares
AMBI.W,"Ambipar Emergency Response Warrants to purchase Class A ordinary shares, each whole warrant exercisable for one Class A ordinary share at an exercise price of $11.50 per share"
AMBO,Ambow Education Holding Ltd. American Depository Shares (each representing twenty (20) Class A Ordinary Shares)
AMBP,Ardagh Metal Packaging S.A. Ordinary Shares
AMBP.W,"Ardagh Metal Packaging S.A. Warrants, each exercisable for one Share at an exercise price of $11.50 per share"
AMC,"AMC Entertainment Holdings, Inc. Class A Common Stock"
AMCR,Amcor plc Ordinary Shares
AMCX,AMC Networks Inc. - Class A Common Stock
AMD,"Advanced Micro Devices, Inc. - Common Stock"
AMDL,GraniteShares 2x Long AMD Daily ETF
AMDS,GraniteShares 1x Short AMD Daily ETF
AMDY,Tidal Trust II Yieldmax AMD Option Income Strategy ETF
AME,"AMETEK, Inc."
AMED,Amedisys Inc - Common Stock
AMG,"Affiliated Managers Group, Inc. Common Stock"
AMGN,Amgen Inc. - Common Stock
AMH,American Homes 4 Rent Common Shares of Beneficial Interest
AMH$G,American Homes 4 Rent Series G cumulative redeemable perpetual preferred shares of beneficial interest
AMH$H,American Homes 4 Rent Series H cumulative redeemable perpetual Preferred Shares of Beneficial Interest
AMID,Argent Mid Cap ETF
AMIX,"Autonomix Medical, Inc. - Common Stock"
AMJB,"JPMorgan Chase & Co. Alerian MLP Index ETNs due January 28, 2044"
AMKR,"Amkor Technology, Inc. - Common Stock"
AMLI,American Lithium Corp. - Common Stock
AMLP,Alerian MLP ETF
AMLX,"Amylyx Pharmaceuticals, Inc. - Common Stock"
AMN,AMN Healthcare Services Inc
AMNA,ETRACS Alerian Midstream Energy Index ETN
AMND,UBS AG ETRACS Alerian Midstream Energy High Dividend Index ETN
AMOM,QRAFT AI-Enhanced U.S. Large Cap Momentum ETF
AMP,"Ameriprise Financial, Inc. Common Stock"
AMPD,CNIC ICE U.S. Carbon Neutral Power Futures Index ETF
AMPG,"Amplitech Group, Inc. - Common Stock"
AMPGW,"Amplitech Group, Inc. - Warrants"
AMPH,"Amphastar Pharmaceuticals, Inc. - Common Stock"
AMPL,"Amplitude, Inc. - Class A Common Stock"
AMPS,"Altus Power, Inc. Class A Common Stock"
AMPX,"Amprius Technologies, Inc. Common Stock"
AMPX.W,"Amprius Technologies, Inc. Warrants to purchase one share of Common Stock at an exercise price of $11.50 per share"
AMPY,Amplify Energy Corp. Common Stock
AMR,"Alpha Metallurgical Resources, Inc. Common Stock"
AMRC,"Ameresco, Inc. Class A Common Stock"
AMRK,"A-Mark Precious Metals, Inc. - Common Stock"
AMRN,"Amarin Corporation plc - American Depositary Shares, each representing one Ordinary Share"
AMRX,"Amneal Pharmaceuticals, Inc. - Class A Common Stock"
AMS,American Shared Hospital Services Common Stock
AMSC,American Superconductor Corporation - Common Stock
AMSF,"AMERISAFE, Inc. - Common Stock"
AMST,Amesite Inc. - Common Stock
AMT,American Tower Corporation (REIT) Common Stock
AMTB,Amerant Bancorp Inc. Class A Common Stock
AMTD,"AMTD IDEA Group American Depositary Shares, each representing six (6) Class A Ordinary Shares"
AMTM,"Amentum Holdings, Inc. Common Stock"
AMTR,ETRACS Alerian Midstream Energy Total Return Index ETN
AMTX,"Aemetis, Inc - Common Stock"
AMUB,"ETRACS Alerian MLP Index ETN Series B due July 18, 2042"
AMWD,American Woodmark Corporation - Common Stock
AMWL,American Well Corporation Class A Common Stock
AMX,"America Movil, S.A.B. de C.V. American Depositary Shares (each representing the right to receive twenty (20) Series B Shares"
AMZA,InfraCap MLP ETF
AMZD,Direxion Daily AMZN Bear 1X Shares
AMZN,"Amazon.com, Inc. - Common Stock"
AMZP,NEOS ETF Trust Kurv Yield Premium Strategy Amazon (AMZN) ETF
AMZU,Direxion Daily AMZN Bull 2X Shares
AMZY,Tidal ETF Trust II YieldMax AMZN Option Income Strategy ETF
AMZZ,GraniteShares 2x Long AMZN Daily ETF
AN,"AutoNation, Inc. Common Stock"
ANAB,"AnaptysBio, Inc. - Common Stock"
ANDE,"The Andersons, Inc. - Common Stock"
ANEB,"Anebulo Pharmaceuticals, Inc. - Common Stock"
ANET,"Arista Networks, Inc. Common Stock"
